,Movie Name,Year of Release,Duration (Min),Genres,Director,Movie Rating,Description,Photo URL
0,The Shawshank Redemption,1994,142,['Drama'],Frank Darabont,9.3,"Over the course of several years, two convicts form a friendship, seeking consolation and, eventually, redemption through basic compassion.","https://m.media-amazon.com/images/M/MV5BNDE3ODcxYzMtY2YzZC00NmNlLWJiNDMtZDViZWM2MzIxZDYwXkEyXkFqcGdeQXVyNjAwNDUxODI@._V1_UX140_CR0,0,140,209_AL_.jpg"
1,The Godfather,1972,175,"['Crime', ' Drama']",Francis Ford Coppola,9.2,The aging patriarch of an organized crime dynasty transfers control of his clandestine empire to his reluctant son.,"https://m.media-amazon.com/images/M/MV5BM2MyNjYxNmUtYTAwNi00MTYxLWJmNWYtYzZlODY3ZTk3OTFlXkEyXkFqcGdeQXVyNzkwMjQ5NzM@._V1_UY209_CR3,0,140,209_AL_.jpg"
2,The Dark Knight,2008,152,"['Action', ' Crime', ' Drama']",Christopher Nolan,9.0,"When the menace known as the Joker wreaks havoc and chaos on the people of Gotham, Batman must accept one of the greatest psychological and physical tests of his ability to fight injustice.","https://m.media-amazon.com/images/M/MV5BMTMxNTMwODM0NF5BMl5BanBnXkFtZTcwODAyMTk2Mw@@._V1_UY209_CR0,0,140,209_AL_.jpg"
3,Pulp Fiction,1994,154,"['Crime', ' Drama']",Quentin Tarantino,8.9,"The lives of two mob hitmen, a boxer, a gangster and his wife, and a pair of diner bandits intertwine in four tales of violence and redemption.","https://m.media-amazon.com/images/M/MV5BNGNhMDIzZTUtNTBlZi00MTRlLWFjM2ItYzViMjE3YzI5MjljXkEyXkFqcGdeQXVyNzkwMjQ5NzM@._V1_UY209_CR2,0,140,209_AL_.jpg"
4,Inception,2010,148,"['Action', ' Adventure', ' Sci-Fi']",Christopher Nolan,8.8,"A thief who steals corporate secrets through the use of dream-sharing technology is given the inverse task of planting an idea into the mind of a C.E.O., but his tragic past may doom the project and his team to disaster.","https://m.media-amazon.com/images/M/MV5BMjAxMzY3NjcxNF5BMl5BanBnXkFtZTcwNTI5OTM0Mw@@._V1_UY209_CR0,0,140,209_AL_.jpg"
5,The Lord of the Rings: The Fellowship of the Ring,2001,178,"['Action', ' Adventure', ' Drama']",Peter Jackson,8.9,A meek Hobbit from the Shire and eight companions set out on a journey to destroy the powerful One Ring and save Middle-earth from the Dark Lord Sauron.,"https://m.media-amazon.com/images/M/MV5BN2EyZjM3NzUtNWUzMi00MTgxLWI0NTctMzY4M2VlOTdjZWRiXkEyXkFqcGdeQXVyNDUzOTQ5MjY@._V1_UY209_CR0,0,140,209_AL_.jpg"
6,A Quiet Place,2018,90,"['Drama', ' Horror', ' Sci-Fi']",John Krasinski,7.5,A family struggles for survival in a world where most humans have been killed by blind but noise-sensitive creatures. They are forced to communicate in sign language to keep the creatures at bay.,"https://m.media-amazon.com/images/M/MV5BMjI0MDMzNTQ0M15BMl5BanBnXkFtZTgwMTM5NzM3NDM@._V1_UY209_CR0,0,140,209_AL_.jpg"
7,The Florida Project,2017,111,['Drama'],Sean Baker,7.6,"Set over one summer, the film follows precocious six-year-old Moonee as she courts mischief and adventure with her ragtag playmates and bonds with her rebellious but caring mother, all while living in the shadows of Walt Disney World.","https://m.media-amazon.com/images/M/MV5BMjg4ZmY1MmItMjFjOS00ZTg2LWJjNDYtNDM2YmM2NzhiNmZhXkEyXkFqcGdeQXVyNTAzMTY4MDA@._V1_UY209_CR0,0,140,209_AL_.jpg"
8,Blade Runner 2049,2017,164,"['Action', ' Drama', ' Mystery']",Denis Villeneuve,8.0,"Young Blade Runner K's discovery of a long-buried secret leads him to track down former Blade Runner Rick Deckard, who's been missing for thirty years.","https://m.media-amazon.com/images/M/MV5BNzA1Njg4NzYxOV5BMl5BanBnXkFtZTgwODk5NjU3MzI@._V1_UY209_CR0,0,140,209_AL_.jpg"
9,The Silence of the Lambs,1991,118,"['Crime', ' Drama', ' Thriller']",Jonathan Demme,8.6,"A young F.B.I. cadet must receive the help of an incarcerated and manipulative cannibal killer to help catch another serial killer, a madman who skins his victims.","https://m.media-amazon.com/images/M/MV5BNjNhZTk0ZmEtNjJhMi00YzFlLWE1MmEtYzM1M2ZmMGMwMTU4XkEyXkFqcGdeQXVyNjU0OTQ0OTY@._V1_UY209_CR1,0,140,209_AL_.jpg"
10,Whiplash,2014,106,"['Drama', ' Music']",Damien Chazelle,8.5,A promising young drummer enrolls at a cut-throat music conservatory where his dreams of greatness are mentored by an instructor who will stop at nothing to realize a student's potential.,"https://m.media-amazon.com/images/M/MV5BOTA5NDZlZGUtMjAxOS00YTRkLTkwYmMtYWQ0NWEwZDZiNjEzXkEyXkFqcGdeQXVyMTMxODk2OTU@._V1_UY209_CR0,0,140,209_AL_.jpg"
11,Schindler's List,1993,195,"['Biography', ' Drama', ' History']",Steven Spielberg,9.0,"In German-occupied Poland during World War II, industrialist Oskar Schindler gradually becomes concerned for his Jewish workforce after witnessing their persecution by the Nazis.","https://m.media-amazon.com/images/M/MV5BNDE4OTMxMTctNmRhYy00NWE2LTg3YzItYTk3M2UwOTU5Njg4XkEyXkFqcGdeQXVyNjU0OTQ0OTY@._V1_UX140_CR0,0,140,209_AL_.jpg"
12,Mad Max: Fury Road,2015,120,"['Action', ' Adventure', ' Sci-Fi']",George Miller,8.1,"In a post-apocalyptic wasteland, a woman rebels against a tyrannical ruler in search for her homeland with the aid of a group of female prisoners, a psychotic worshiper and a drifter named Max.","https://m.media-amazon.com/images/M/MV5BN2EwM2I5OWMtMGQyMi00Zjg1LWJkNTctZTdjYTA4OGUwZjMyXkEyXkFqcGdeQXVyMTMxODk2OTU@._V1_UY209_CR0,0,140,209_AL_.jpg"
13,No Country for Old Men,2007,122,"['Crime', ' Drama', ' Thriller']",Ethan Coen,8.2,Violence and mayhem ensue after a hunter stumbles upon the aftermath of a drug deal gone wrong and over two million dollars in cash near the Rio Grande.,"https://m.media-amazon.com/images/M/MV5BMjA5Njk3MjM4OV5BMl5BanBnXkFtZTcwMTc5MTE1MQ@@._V1_UY209_CR1,0,140,209_AL_.jpg"
14,The Princess Bride,1987,98,"['Adventure', ' Comedy', ' Family']",Rob Reiner,8.0,"A bedridden boy's grandfather reads him the story of a farmboy-turned-pirate who encounters numerous obstacles, enemies and allies in his quest to be reunited with his true love.","https://m.media-amazon.com/images/M/MV5BYzdiOTVjZmQtNjAyNy00YjA2LTk5ZTAtNmJkMGQ5N2RmNjUxXkEyXkFqcGdeQXVyMjUzOTY1NTc@._V1_UY209_CR1,0,140,209_AL_.jpg"
15,Fargo,1996,98,"['Crime', ' Thriller']",Joel Coen,8.1,Minnesota car salesman Jerry Lundegaard's inept crime falls apart due to his and his henchmen's bungling and the persistent police work of the quite pregnant Marge Gunderson.,"https://m.media-amazon.com/images/M/MV5BNDJiZDgyZjctYmRjMS00ZjdkLTkwMTEtNGU1NDg3NDQ0Yzk1XkEyXkFqcGdeQXVyNzkwMjQ5NzM@._V1_UY209_CR1,0,140,209_AL_.jpg"
16,One Flew Over the Cuckoo's Nest,1975,133,['Drama'],Milos Forman,8.7,"In the Fall of 1963, a Korean War veteran and criminal pleads insanity and is admitted to a mental institution, where he rallies up the scared patients against the tyrannical nurse.","https://m.media-amazon.com/images/M/MV5BZjA0OWVhOTAtYWQxNi00YzNhLWI4ZjYtNjFjZTEyYjJlNDVlL2ltYWdlL2ltYWdlXkEyXkFqcGdeQXVyMTQxNzMzNDI@._V1_UY209_CR0,0,140,209_AL_.jpg"
17,Goodfellas,1990,145,"['Biography', ' Crime', ' Drama']",Martin Scorsese,8.7,"The story of Henry Hill and his life in the mafia, covering his relationship with his wife Karen and his mob partners Jimmy Conway and Tommy DeVito.","https://m.media-amazon.com/images/M/MV5BY2NkZjEzMDgtN2RjYy00YzM1LWI4ZmQtMjIwYjFjNmI3ZGEwXkEyXkFqcGdeQXVyNzkwMjQ5NzM@._V1_UX140_CR0,0,140,209_AL_.jpg"
18,Django Unchained,2012,165,"['Drama', ' Western']",Quentin Tarantino,8.5,"With the help of a German bounty-hunter, a freed slave sets out to rescue his wife from a brutal plantation owner in Mississippi.","https://m.media-amazon.com/images/M/MV5BMjIyNTQ5NjQ1OV5BMl5BanBnXkFtZTcwODg1MDU4OA@@._V1_UY209_CR0,0,140,209_AL_.jpg"
19,The Sting,1973,129,"['Comedy', ' Crime', ' Drama']",George Roy Hill,8.3,Two grifters team up to pull off the ultimate con.,"https://m.media-amazon.com/images/M/MV5BNGU3NjQ4YTMtZGJjOS00YTQ3LThmNmItMTI5MDE2ODI3NzY3XkEyXkFqcGdeQXVyMjUzOTY1NTc@._V1_UX140_CR0,0,140,209_AL_.jpg"
20,La La Land,2016,128,"['Comedy', ' Drama', ' Music']",Damien Chazelle,8.0,"While navigating their careers in Los Angeles, a pianist and an actress fall in love while attempting to reconcile their aspirations for the future.","https://m.media-amazon.com/images/M/MV5BMzUzNDM2NzM2MV5BMl5BanBnXkFtZTgwNTM3NTg4OTE@._V1_UY209_CR0,0,140,209_AL_.jpg"
21,Eternal Sunshine of the Spotless Mind,2004,108,"['Drama', ' Romance', ' Sci-Fi']",Michel Gondry,8.3,"When their relationship turns sour, a couple undergoes a medical procedure to have each other erased from their memories for ever.","https://m.media-amazon.com/images/M/MV5BMTY4NzcwODg3Nl5BMl5BanBnXkFtZTcwNTEwOTMyMw@@._V1_UY209_CR0,0,140,209_AL_.jpg"
22,Alien,1979,117,"['Horror', ' Sci-Fi']",Ridley Scott,8.5,The crew of a commercial spacecraft encounters a deadly lifeform after investigating a mysterious transmission of unknown origin.,"https://m.media-amazon.com/images/M/MV5BOGQzZTBjMjQtOTVmMS00NGE5LWEyYmMtOGQ1ZGZjNmRkYjFhXkEyXkFqcGdeQXVyMjUzOTY1NTc@._V1_UX140_CR0,0,140,209_AL_.jpg"
23,The Dark Knight Rises,2012,164,"['Action', ' Drama', ' Thriller']",Christopher Nolan,8.4,"Eight years after the Joker's reign of chaos, Batman is coerced out of exile with the assistance of the mysterious Selina Kyle in order to defend Gotham City from the vicious guerrilla terrorist Bane.","https://m.media-amazon.com/images/M/MV5BMTk4ODQzNDY3Ml5BMl5BanBnXkFtZTcwODA0NTM4Nw@@._V1_UY209_CR0,0,140,209_AL_.jpg"
24,Taxi Driver,1976,114,"['Crime', ' Drama']",Martin Scorsese,8.2,"A mentally unstable veteran works as a nighttime taxi driver in New York City, where the perceived decadence and sleaze fuels his urge for violent action.","https://m.media-amazon.com/images/M/MV5BM2M1MmVhNDgtNmI0YS00ZDNmLTkyNjctNTJiYTQ2N2NmYzc2XkEyXkFqcGdeQXVyNzkwMjQ5NzM@._V1_UX140_CR0,0,140,209_AL_.jpg"
25,The Departed,2006,151,"['Crime', ' Drama', ' Thriller']",Martin Scorsese,8.5,An undercover cop and a mole in the police attempt to identify each other while infiltrating an Irish gang in South Boston.,"https://m.media-amazon.com/images/M/MV5BMTI1MTY2OTIxNV5BMl5BanBnXkFtZTYwNjQ4NjY3._V1_UY209_CR0,0,140,209_AL_.jpg"
26,Aliens,1986,137,"['Action', ' Adventure', ' Sci-Fi']",James Cameron,8.4,"Decades after surviving the Nostromo incident, Ellen Ripley is sent out to re-establish contact with a terraforming colony but finds herself battling the Alien Queen and her offspring.","https://m.media-amazon.com/images/M/MV5BOGJkY2EyOWYtYWRmNy00ZTEzLTllMDAtYzYzYjA0ZjFhZWJjXkEyXkFqcGdeQXVyMTUzMDUzNTI3._V1_UX140_CR0,0,140,209_AL_.jpg"
27,Moana,I 2016,107,"['Animation', ' Adventure', ' Comedy']",Ron Clements,7.6,"In ancient Polynesia, when a terrible curse incurred by the demigod Maui reaches Moana's island, she answers the Ocean's call to seek out Maui to set things right.","https://m.media-amazon.com/images/M/MV5BMjI4MzU5NTExNF5BMl5BanBnXkFtZTgwNzY1MTEwMDI@._V1_UY209_CR0,0,140,209_AL_.jpg"
28,Dunkirk,2017,106,"['Action', ' Drama', ' History']",Christopher Nolan,7.8,"Allied soldiers from Belgium, the British Commonwealth and Empire, and France are surrounded by the German Army and evacuated during a fierce battle in World War II.","https://m.media-amazon.com/images/M/MV5BN2YyZjQ0NTEtNzU5MS00NGZkLTg0MTEtYzJmMWY3MWRhZjM2XkEyXkFqcGdeQXVyMDA4NzMyOA@@._V1_UY209_CR0,0,140,209_AL_.jpg"
29,The Lord of the Rings: The Return of the King,2003,201,"['Action', ' Adventure', ' Drama']",Peter Jackson,9.0,Gandalf and Aragorn lead the World of Men against Sauron's army to draw his gaze from Frodo and Sam as they approach Mount Doom with the One Ring.,"https://m.media-amazon.com/images/M/MV5BNzA5ZDNlZWMtM2NhNS00NDJjLTk4NDItYTRmY2EwMWZlMTY3XkEyXkFqcGdeQXVyNzkwMjQ5NzM@._V1_UY209_CR0,0,140,209_AL_.jpg"
30,Star Wars,1977,121,"['Action', ' Adventure', ' Fantasy']",George Lucas,8.6,"Luke Skywalker joins forces with a Jedi Knight, a cocky pilot, a Wookiee and two droids to save the galaxy from the Empire's world-destroying battle station, while also attempting to rescue Princess Leia from the mysterious Darth Vader.","https://m.media-amazon.com/images/M/MV5BOTA5NjhiOTAtZWM0ZC00MWNhLThiMzEtZDFkOTk2OTU1ZDJkXkEyXkFqcGdeQXVyMTA4NDI1NTQx._V1_UX140_CR0,0,140,209_AL_.jpg"
31,Avengers: Endgame,2019,181,"['Action', ' Adventure', ' Drama']",Anthony Russo,8.4,"After the devastating events of Avengers: Infinity War (2018), the universe is in ruins. With the help of remaining allies, the Avengers assemble once more in order to reverse Thanos' actions and restore balance to the universe.","https://m.media-amazon.com/images/M/MV5BMTc5MDE2ODcwNV5BMl5BanBnXkFtZTgwMzI2NzQ2NzM@._V1_UY209_CR0,0,140,209_AL_.jpg"
32,Back to the Future,1985,116,"['Adventure', ' Comedy', ' Sci-Fi']",Robert Zemeckis,8.5,"Marty McFly, a 17-year-old high school student, is accidentally sent 30 years into the past in a time-traveling DeLorean invented by his close friend, the maverick scientist Doc Brown.","https://m.media-amazon.com/images/M/MV5BZmU0M2Y1OGUtZjIxNi00ZjBkLTg1MjgtOWIyNThiZWIwYjRiXkEyXkFqcGdeQXVyMTQxNzMzNDI@._V1_UX140_CR0,0,140,209_AL_.jpg"
33,Memento,2000,113,"['Mystery', ' Thriller']",Christopher Nolan,8.4,A man with short-term memory loss attempts to track down his wife's murderer.,"https://m.media-amazon.com/images/M/MV5BZTcyNjk1MjgtOWI3Mi00YzQwLWI5MTktMzY4ZmI2NDAyNzYzXkEyXkFqcGdeQXVyNjU0OTQ0OTY@._V1_UY209_CR1,0,140,209_AL_.jpg"
34,Raiders of the Lost Ark,1981,115,"['Action', ' Adventure']",Steven Spielberg,8.4,"In 1936, archaeologist and adventurer Indiana Jones is hired by the U.S. government to find the Ark of the Covenant before the Nazis can obtain its awesome powers.","https://m.media-amazon.com/images/M/MV5BNTU2ODkyY2MtMjU1NC00NjE1LWEzYjgtMWQ3MzRhMTE0NDc0XkEyXkFqcGdeQXVyMjM4MzQ4OTQ@._V1_UY209_CR1,0,140,209_AL_.jpg"
35,Sen to Chihiro no kamikakushi,2001,125,"['Animation', ' Adventure', ' Family']",Hayao Miyazaki,8.6,"During her family's move to the suburbs, a sullen 10-year-old girl wanders into a world ruled by gods, witches and spirits, a world where humans are changed into beasts.","https://m.media-amazon.com/images/M/MV5BMjlmZmI5MDctNDE2YS00YWE0LWE5ZWItZDBhYWQ0NTcxNWRhXkEyXkFqcGdeQXVyMTMxODk2OTU@._V1_UY209_CR0,0,140,209_AL_.jpg"
36,2001: A Space Odyssey,1968,149,"['Adventure', ' Sci-Fi']",Stanley Kubrick,8.3,"After uncovering a mysterious artifact buried beneath the Lunar surface, a spacecraft is sent to Jupiter to find its origins: a spacecraft manned by two men and the supercomputer HAL 9000.","https://m.media-amazon.com/images/M/MV5BMmNlYzRiNDctZWNhMi00MzI4LThkZTctMTUzMmZkMmFmNThmXkEyXkFqcGdeQXVyNzkwMjQ5NzM@._V1_UY209_CR0,0,140,209_AL_.jpg"
37,Get Out,I 2017,104,"['Horror', ' Mystery', ' Thriller']",Jordan Peele,7.8,"A young African-American visits his white girlfriend's parents for the weekend, where his simmering uneasiness about their reception of him eventually reaches a boiling point.","https://m.media-amazon.com/images/M/MV5BMjUxMDQwNjcyNl5BMl5BanBnXkFtZTgwNzcwMzc0MTI@._V1_UY209_CR0,0,140,209_AL_.jpg"
38,Guardians of the Galaxy,2014,121,"['Action', ' Adventure', ' Comedy']",James Gunn,8.0,A group of intergalactic criminals must pull together to stop a fanatical warrior with plans to purge the universe.,"https://m.media-amazon.com/images/M/MV5BNDIzMTk4NDYtMjg5OS00ZGI0LWJhZDYtMzdmZGY1YWU5ZGNkXkEyXkFqcGdeQXVyMTI5NzUyMTIz._V1_UY209_CR0,0,140,209_AL_.jpg"
39,12 Angry Men,1957,96,"['Crime', ' Drama']",Sidney Lumet,9.0,The jury in a New York City murder trial is frustrated by a single member whose skeptical caution forces them to more carefully consider the evidence before jumping to a hasty verdict.,"https://m.media-amazon.com/images/M/MV5BMWU4N2FjNzYtNTVkNC00NzQ0LTg0MjAtYTJlMjFhNGUxZDFmXkEyXkFqcGdeQXVyNjc1NTYyMjg@._V1_UX140_CR0,0,140,209_AL_.jpg"
40,Terminator 2: Judgment Day,1991,137,"['Action', ' Sci-Fi']",James Cameron,8.6,"A cyborg, identical to the one who failed to kill Sarah Connor, must now protect her ten year old son John from an even more advanced and powerful cyborg.","https://m.media-amazon.com/images/M/MV5BMGU2NzRmZjUtOGUxYS00ZjdjLWEwZWItY2NlM2JhNjkxNTFmXkEyXkFqcGdeQXVyNjU0OTQ0OTY@._V1_UY209_CR0,0,140,209_AL_.jpg"
41,The Godfather Part II,1974,202,"['Crime', ' Drama']",Francis Ford Coppola,9.0,"The early life and career of Vito Corleone in 1920s New York City is portrayed, while his son, Michael, expands and tightens his grip on the family crime syndicate.","https://m.media-amazon.com/images/M/MV5BMWMwMGQzZTItY2JlNC00OWZiLWIyMDctNDk2ZDQ2YjRjMWQ0XkEyXkFqcGdeQXVyNzkwMjQ5NzM@._V1_UY209_CR3,0,140,209_AL_.jpg"
42,Apocalypse Now,1979,147,"['Drama', ' Mystery', ' War']",Francis Ford Coppola,8.4,A U.S. Army officer serving in Vietnam is tasked with assassinating a renegade Special Forces Colonel who sees himself as a god.,"https://m.media-amazon.com/images/M/MV5BYmQyNTA1ZGItNjZjMi00NzFlLWEzMWEtNWMwN2Q2MjJhYzEyXkEyXkFqcGdeQXVyMjUzOTY1NTc@._V1_UX140_CR0,0,140,209_AL_.jpg"
43,Sicario,2015,121,"['Action', ' Crime', ' Drama']",Denis Villeneuve,7.7,An idealistic FBI agent is enlisted by a government task force to aid in the escalating war against drugs at the border area between the U.S. and Mexico.,"https://m.media-amazon.com/images/M/MV5BMjA5NjM3NTk1M15BMl5BanBnXkFtZTgwMzg1MzU2NjE@._V1_UX140_CR0,0,140,209_AL_.jpg"
44,Baby Driver,2017,113,"['Action', ' Crime', ' Drama']",Edgar Wright,7.5,"After being coerced into working for a crime boss, a young getaway driver finds himself taking part in a heist doomed to fail.","https://m.media-amazon.com/images/M/MV5BMjM3MjQ1MzkxNl5BMl5BanBnXkFtZTgwODk1ODgyMjI@._V1_UY209_CR0,0,140,209_AL_.jpg"
45,Cidade de Deus,2002,130,"['Crime', ' Drama']",Fernando Meirelles,8.6,"In the slums of Rio, two kids' paths diverge as one struggles to become a photographer and the other a kingpin.","https://m.media-amazon.com/images/M/MV5BMGU5OWEwZDItNmNkMC00NzZmLTk1YTctNzVhZTJjM2NlZTVmXkEyXkFqcGdeQXVyMTMxODk2OTU@._V1_UY209_CR1,0,140,209_AL_.jpg"
46,Ah-ga-ssi,2016,145,"['Drama', ' Romance', ' Thriller']",Park Chan-wook,8.1,"A woman is hired as a handmaiden to a Japanese heiress, but secretly she is involved in a plot to defraud her.","https://m.media-amazon.com/images/M/MV5BNDJhYTk2MTctZmVmOS00OTViLTgxNjQtMzQxOTRiMDdmNGRjXkEyXkFqcGdeQXVyMTMxODk2OTU@._V1_UY209_CR2,0,140,209_AL_.jpg"
47,Looper,2012,119,"['Action', ' Drama', ' Sci-Fi']",Rian Johnson,7.4,"In 2074, when the mob wants to get rid of someone, the target is sent into the past, where a hired gun awaits - someone like Joe - who one day learns the mob wants to 'close the loop' by sending back Joe's future self for assassination.","https://m.media-amazon.com/images/M/MV5BMTg5NTA3NTg4NF5BMl5BanBnXkFtZTcwNTA0NDYzOA@@._V1_UY209_CR0,0,140,209_AL_.jpg"
48,Mission: Impossible - Fallout,2018,147,"['Action', ' Adventure', ' Thriller']",Christopher McQuarrie,7.7,"Ethan Hunt and his IMF team, along with some familiar allies, race against time after a mission gone wrong.","https://m.media-amazon.com/images/M/MV5BNjRlZmM0ODktY2RjNS00ZDdjLWJhZGYtNDljNWZkMGM5MTg0XkEyXkFqcGdeQXVyNjAwMjI5MDk@._V1_UX140_CR0,0,140,209_AL_.jpg"
49,Call Me by Your Name,2017,132,"['Drama', ' Romance']",Luca Guadagnino,7.8,"In 1980s Italy, romance blossoms between a seventeen-year-old student and the older man hired as his father's research assistant.","https://m.media-amazon.com/images/M/MV5BNDk3NTEwNjc0MV5BMl5BanBnXkFtZTgwNzYxNTMwMzI@._V1_UY209_CR0,0,140,209_AL_.jpg"
50,The Usual Suspects,1995,106,"['Crime', ' Drama', ' Mystery']",Bryan Singer,8.5,The sole survivor of a pier shoot-out tells the story of how a notorious criminal influenced the events that began with five criminals meeting in a seemingly random police lineup.,"https://m.media-amazon.com/images/M/MV5BYTViNjMyNmUtNDFkNC00ZDRlLThmMDUtZDU2YWE4NGI2ZjVmXkEyXkFqcGdeQXVyNjU0OTQ0OTY@._V1_UY209_CR0,0,140,209_AL_.jpg"
51,Trainspotting,1996,93,['Drama'],Danny Boyle,8.1,"Renton, deeply immersed in the Edinburgh drug scene, tries to clean up and get out despite the allure of drugs and the influence of friends.","https://m.media-amazon.com/images/M/MV5BMzA5Zjc3ZTMtMmU5YS00YTMwLWI4MWUtYTU0YTVmNjVmODZhXkEyXkFqcGdeQXVyNjU0OTQ0OTY@._V1_UY209_CR0,0,140,209_AL_.jpg"
52,Notorious,1946,102,"['Drama', ' Film-Noir', ' Romance']",Alfred Hitchcock,7.9,The daughter of a convicted Nazi spy is asked by American agents to gather information on a ring of Nazi scientists in South America. How far will she have to go to ingratiate herself with them?,"https://m.media-amazon.com/images/M/MV5BYTc1NGViOTMtNjZhNS00OGY2LWI4MmItOWQwNTY4MDMzNWI3L2ltYWdlXkEyXkFqcGdeQXVyNjc1NTYyMjg@._V1_UX140_CR0,0,140,209_AL_.jpg"
53,Blade Runner,1982,117,"['Action', ' Drama', ' Sci-Fi']",Ridley Scott,8.1,A blade runner must pursue and terminate four replicants who stole a ship in space and have returned to Earth to find their creator.,"https://m.media-amazon.com/images/M/MV5BNzQzMzJhZTEtOWM4NS00MTdhLTg0YjgtMjM4MDRkZjUwZDBlXkEyXkFqcGdeQXVyNjU0OTQ0OTY@._V1_UY209_CR0,0,140,209_AL_.jpg"
54,Saving Private Ryan,1998,169,"['Drama', ' War']",Steven Spielberg,8.6,"Following the Normandy Landings, a group of U.S. soldiers go behind enemy lines to retrieve a paratrooper whose brothers have been killed in action.","https://m.media-amazon.com/images/M/MV5BZjhkMDM4MWItZTVjOC00ZDRhLThmYTAtM2I5NzBmNmNlMzI1XkEyXkFqcGdeQXVyNDYyMDk5MTU@._V1_UY209_CR1,0,140,209_AL_.jpg"
55,A Clockwork Orange,1971,136,"['Crime', ' Sci-Fi']",Stanley Kubrick,8.3,"In the future, a sadistic gang leader is imprisoned and volunteers for a conduct-aversion experiment, but it doesn't go as planned.","https://m.media-amazon.com/images/M/MV5BMTY3MjM1Mzc4N15BMl5BanBnXkFtZTgwODM0NzAxMDE@._V1_UY209_CR0,0,140,209_AL_.jpg"
56,The Martian,2015,144,"['Adventure', ' Drama', ' Sci-Fi']",Ridley Scott,8.0,"An astronaut becomes stranded on Mars after his team assume him dead, and must rely on his ingenuity to find a way to signal to Earth that he is alive and can survive until a potential rescue.","https://m.media-amazon.com/images/M/MV5BMTc2MTQ3MDA1Nl5BMl5BanBnXkFtZTgwODA3OTI4NjE@._V1_UY209_CR0,0,140,209_AL_.jpg"
57,There Will Be Blood,2007,158,['Drama'],Paul Thomas Anderson,8.2,"A story of family, religion, hatred, oil and madness, focusing on a turn-of-the-century prospector in the early days of the business.","https://m.media-amazon.com/images/M/MV5BMjAxODQ4MDU5NV5BMl5BanBnXkFtZTcwMDU4MjU1MQ@@._V1_UY209_CR0,0,140,209_AL_.jpg"
58,Jagten,2012,115,['Drama'],Thomas Vinterberg,8.3,"A teacher lives a lonely life, all the while struggling over his son's custody. His life slowly gets better as he finds love and receives good news from his son, but his new luck is about to be brutally shattered by an innocent little lie.","https://m.media-amazon.com/images/M/MV5BMTg2NDg3ODg4NF5BMl5BanBnXkFtZTcwNzk3NTc3Nw@@._V1_UY209_CR3,0,140,209_AL_.jpg"
59,Her,2013,126,"['Drama', ' Romance', ' Sci-Fi']",Spike Jonze,8.0,"In a near future, a lonely writer develops an unlikely relationship with an operating system designed to meet his every need.","https://m.media-amazon.com/images/M/MV5BMjA1Nzk0OTM2OF5BMl5BanBnXkFtZTgwNjU2NjEwMDE@._V1_UY209_CR0,0,140,209_AL_.jpg"
60,The Lord of the Rings: The Two Towers,2002,179,"['Action', ' Adventure', ' Drama']",Peter Jackson,8.8,"While Frodo and Sam edge closer to Mordor with the help of the shifty Gollum, the divided fellowship makes a stand against Sauron's new ally, Saruman, and his hordes of Isengard.","https://m.media-amazon.com/images/M/MV5BZGMxZTdjZmYtMmE2Ni00ZTdkLWI5NTgtNjlmMjBiNzU2MmI5XkEyXkFqcGdeQXVyNjU0OTQ0OTY@._V1_UX140_CR0,0,140,209_AL_.jpg"
61,Harry Potter and the Deathly Hallows - Part 2,2011,130,"['Adventure', ' Family', ' Fantasy']",David Yates,8.1,"Harry, Ron, and Hermione search for Voldemort's remaining Horcruxes in their effort to destroy the Dark Lord as the final battle rages on at Hogwarts.","https://m.media-amazon.com/images/M/MV5BMGVmMWNiMDktYjQ0Mi00MWIxLTk0N2UtN2ZlYTdkN2IzNDNlXkEyXkFqcGdeQXVyODE5NzE3OTE@._V1_UX140_CR0,0,140,209_AL_.jpg"
62,"Three Billboards Outside Ebbing, Missouri",2017,115,"['Comedy', ' Crime', ' Drama']",Martin McDonagh,8.1,A mother personally challenges the local authorities to solve her daughter's murder when they fail to catch the culprit.,"https://m.media-amazon.com/images/M/MV5BMjI0ODcxNzM1N15BMl5BanBnXkFtZTgwMzIwMTEwNDI@._V1_UY209_CR0,0,140,209_AL_.jpg"
63,The Grand Budapest Hotel,2014,99,"['Adventure', ' Comedy', ' Crime']",Wes Anderson,8.1,"A writer encounters the owner of an aging high-class hotel, who tells him of his early years serving as a lobby boy in the hotel's glorious years under an exceptional concierge.","https://m.media-amazon.com/images/M/MV5BMzM5NjUxOTEyMl5BMl5BanBnXkFtZTgwNjEyMDM0MDE@._V1_UY209_CR0,0,140,209_AL_.jpg"
64,Ratatouille,2007,111,"['Animation', ' Adventure', ' Comedy']",Brad Bird,8.1,A rat who can cook makes an unusual alliance with a young kitchen worker at a famous Paris restaurant.,"https://m.media-amazon.com/images/M/MV5BMTMzODU0NTkxMF5BMl5BanBnXkFtZTcwMjQ4MzMzMw@@._V1_UY209_CR0,0,140,209_AL_.jpg"
65,The Lion King,1994,88,"['Animation', ' Adventure', ' Drama']",Roger Allers,8.5,"Lion prince Simba and his father are targeted by his bitter uncle, who wants to ascend the throne himself.","https://m.media-amazon.com/images/M/MV5BYTYxNGMyZTYtMjE3MS00MzNjLWFjNmYtMDk3N2FmM2JiM2M1XkEyXkFqcGdeQXVyNjY5NDU4NzI@._V1_UY209_CR0,0,140,209_AL_.jpg"
66,The Social Network,2010,120,"['Biography', ' Drama']",David Fincher,7.8,"As Harvard student Mark Zuckerberg creates the social networking site that would become known as Facebook, he is sued by the twins who claimed he stole their idea and by the co-founder who was later squeezed out of the business.","https://m.media-amazon.com/images/M/MV5BOGUyZDUxZjEtMmIzMC00MzlmLTg4MGItZWJmMzBhZjE0Mjc1XkEyXkFqcGdeQXVyMTMxODk2OTU@._V1_UY209_CR0,0,140,209_AL_.jpg"
67,Donnie Darko,2001,113,"['Drama', ' Mystery', ' Sci-Fi']",Richard Kelly,8.0,"After narrowly escaping a bizarre accident, a troubled teenager is plagued by visions of a man in a large rabbit suit who manipulates him to commit a series of crimes.","https://m.media-amazon.com/images/M/MV5BZjZlZDlkYTktMmU1My00ZDBiLWFlNjEtYTBhNjVhOTM4ZjJjXkEyXkFqcGdeQXVyMTMxODk2OTU@._V1_UX140_CR0,0,140,209_AL_.jpg"
