,Movie Name,Year of Release,Duration (Min),Genres,Director,Movie Rating,Description,Photo URL
270,Gangs of Wasseypur,2012,321,"['Action', ' Comedy', ' Crime']",Anurag Kashyap,8.2,"A clash between Sultan and Shahid Khan leads to the expulsion of Khan from Wasseypur, and ignites a deadly blood feud spanning three generations.","https://m.media-amazon.com/images/M/MV5BMTc5NjY4MjUwNF5BMl5BanBnXkFtZTgwODM3NzM5MzE@._V1_UY209_CR0,0,140,209_AL_.jpg"
271,Amores perros,2000,154,"['Drama', ' Thriller']",Alejandro G. Iñárritu,8.1,"A horrific car accident connects three stories, each involving characters dealing with loss, regret, and life's harsh realities, all in the name of love.","https://m.media-amazon.com/images/M/MV5BZjUxNmEwOGItMTBmYi00MWQ1LWExY2MtNDUxMjI0OWM4M2NiXkEyXkFqcGdeQXVyMjUzOTY1NTc@._V1_UX140_CR0,0,140,209_AL_.jpg"
272,Leviafan,2014,140,"['Crime', ' Drama']",Andrey Zvyagintsev,7.6,"In a Russian coastal town, Kolya is forced to fight the corrupt mayor when he is told that his house will be demolished. He recruits a lawyer friend to help, but the man's arrival brings further misfortune for Kolya and his family.","https://m.media-amazon.com/images/M/MV5BMjAwMTY3MTU0Ml5BMl5BanBnXkFtZTgwNzE0ODAwMzE@._V1_UY209_CR0,0,140,209_AL_.jpg"
273,Persona,1966,85,"['Drama', ' Thriller']",Ingmar Bergman,8.1,A nurse is put in charge of a mute actress and finds that their personae are melding together.,"https://m.media-amazon.com/images/M/MV5BYmFlOTcxMWUtZTMzMi00NWIyLTkwOTEtNjIxNmViNzc2Yzc1XkEyXkFqcGdeQXVyMjUzOTY1NTc@._V1_UX140_CR0,0,140,209_AL_.jpg"
274,The 39 Steps,1935,86,"['Crime', ' Mystery', ' Thriller']",Alfred Hitchcock,7.6,"A man in London tries to help a counter-espionage agent, but when the agent is killed and the man stands accused, he must go on the run to save himself and stop a spy ring that is trying to steal top-secret information.","https://m.media-amazon.com/images/M/MV5BMTY5ODAzMTcwOF5BMl5BanBnXkFtZTcwMzYxNDYyNA@@._V1_UY209_CR0,0,140,209_AL_.jpg"
275,Il conformista,1970,113,['Drama'],Bernardo Bertolucci,7.9,"A weak-willed Italian man becomes a fascist flunky who goes abroad to arrange the assassination of his old teacher, now a political dissident.","https://m.media-amazon.com/images/M/MV5BM2JmMDZkYmEtYmVmNy00NTVmLTlkY2YtY2VkZGVjNjU1ZGI1XkEyXkFqcGdeQXVyMjUzOTY1NTc@._V1_UX140_CR0,0,140,209_AL_.jpg"
276,The Third Man,1949,104,"['Film-Noir', ' Mystery', ' Thriller']",Carol Reed,8.1,"Pulp novelist Holly Martins travels to shadowy, postwar Vienna, only to find himself investigating the mysterious death of an old friend, Harry Lime.","https://m.media-amazon.com/images/M/MV5BYjE2OTdhMWUtOGJlMy00ZDViLWIzZjgtYjZkZGZmMDZjYmEyXkEyXkFqcGdeQXVyNzkwMjQ5NzM@._V1_UX140_CR0,0,140,209_AL_.jpg"
277,Withnail & I,1987,107,"['Comedy', ' Drama']",Bruce Robinson,7.5,"In 1969, two substance-abusing, unemployed actors retreat to the countryside for a holiday that proves disastrous.","https://m.media-amazon.com/images/M/MV5BYjE3ODY5OWEtZmE0Mi00MjUxLTg5MmUtZmFkMzM1N2VjMmU5XkEyXkFqcGdeQXVyNTI4MjkwNjA@._V1_UX140_CR0,0,140,209_AL_.jpg"
278,Forbidden Planet,1956,98,"['Adventure', ' Sci-Fi']",Fred M. Wilcox,7.5,"A starship crew in the 23rd century goes to investigate the silence of a distant planet's colony, only to find just two survivors, a powerful robot, and the deadly secret of a lost civilization.","https://m.media-amazon.com/images/M/MV5BOTdmODZkNmQtYjU4Mi00MTcyLTg5YmEtNmVjMWU1M2Y5NzgyXkEyXkFqcGdeQXVyNDYyMDk5MTU@._V1_UX140_CR0,0,140,209_AL_.jpg"
279,Animal Kingdom,2010,113,"['Crime', ' Drama', ' Thriller']",David Michôd,7.2,A seventeen-year-old navigates his survival amongst an explosive criminal family and the detective who thinks he can save him.,"https://m.media-amazon.com/images/M/MV5BMTQ2NjcwNjE4NV5BMl5BanBnXkFtZTcwNDU2NDg1Mw@@._V1_UY209_CR0,0,140,209_AL_.jpg"
280,It Happened One Night,1934,105,"['Comedy', ' Romance']",Frank Capra,8.1,"A renegade reporter trailing a young runaway heiress for a big story joins her on a bus heading from Florida to New York, and they end up stuck with each other when the bus leaves them behind at one of the stops.","https://m.media-amazon.com/images/M/MV5BYzJmMWE5NjAtNWMyZS00NmFiLWIwMDgtZDE2NzczYWFhNzIzXkEyXkFqcGdeQXVyNjc1NTYyMjg@._V1_UX140_CR0,0,140,209_AL_.jpg"
281,Being There,1979,130,"['Comedy', ' Drama']",Hal Ashby,7.9,"After the death of his employer forces him out of the only home he's ever known, a simpleminded, sheltered gardener becomes an unlikely trusted advisor to a powerful tycoon and an insider in Washington politics.","https://m.media-amazon.com/images/M/MV5BNjAzNzJjYzQtMGFmNS00ZjAzLTkwMjgtMWIzYzFkMzM4Njg3XkEyXkFqcGdeQXVyMTY5Nzc4MDY@._V1_UX140_CR0,0,140,209_AL_.jpg"
282,Cinderella,1950,74,"['Animation', ' Family', ' Fantasy']",Clyde Geronimi,7.3,"When Cinderella's cruel stepmother prevents her from attending the Royal Ball, she gets some unexpected help from the lovable mice Gus and Jaq and from her Fairy Godmother.","https://m.media-amazon.com/images/M/MV5BODFmMmE3ODItN2VlNi00NWFkLTg1N2EtZTNkMTIyM2IzNWZhXkEyXkFqcGdeQXVyMTE0OTMwOTg@._V1_UX140_CR0,0,140,209_AL_.jpg"
283,My Left Foot: The Story of Christy Brown,1989,103,"['Biography', ' Drama']",Jim Sheridan,7.8,"Christy Brown, born with cerebral palsy, learns to paint and write with his only controllable limb - his left foot.","https://m.media-amazon.com/images/M/MV5BYjdkNzA4MzYtZThhOS00ZDgzLTlmMDItNmY1ZjI5YjkzZTE1XkEyXkFqcGdeQXVyMTQxNzMzNDI@._V1_UX140_CR0,0,140,209_AL_.jpg"
284,La dolce vita,1960,174,"['Comedy', ' Drama']",Federico Fellini,8.0,A series of stories following a week in the life of a philandering tabloid journalist living in Rome.,"https://m.media-amazon.com/images/M/MV5BODQ0NzY5NGEtYTc5NC00Yjg4LTg4Y2QtZjE2MTkyYTNmNmU2L2ltYWdlL2ltYWdlXkEyXkFqcGdeQXVyNjc1NTYyMjg@._V1_UY209_CR4,0,140,209_AL_.jpg"
285,Badlands,1973,94,"['Action', ' Crime', ' Drama']",Terrence Malick,7.7,"An impressionable teenage girl from a dead-end town, and her older greaser boyfriend, embark on a killing spree in the South Dakota Badlands.","https://m.media-amazon.com/images/M/MV5BY2VhZGExZDQtMTZlOS00OTNmLThjYzktN2VhZDg2ZDA3YzEzXkEyXkFqcGdeQXVyMTUzMDUzNTI3._V1_UX140_CR0,0,140,209_AL_.jpg"
286,High Noon,1952,85,"['Drama', ' Thriller', ' Western']",Fred Zinnemann,8.0,"A town Marshal, despite the disagreements of his newlywed bride and the townspeople around him, must face a gang of deadly killers alone at ""high noon"" when the gang leader, an outlaw he ""sent up"" years ago, arrives on the noon train.","https://m.media-amazon.com/images/M/MV5BOWIzZGUxZmItOThkMS00Y2QxLTg0MTYtMDdhMjRlNTNlYTI3L2ltYWdlXkEyXkFqcGdeQXVyNjc1NTYyMjg@._V1_UX140_CR0,0,140,209_AL_.jpg"
287,Once,I 2007,86,"['Drama', ' Music', ' Romance']",John Carney,7.8,"A modern-day musical about a busker and an immigrant and their eventful week in Dublin, as they write, rehearse and record songs that tell their love story.","https://m.media-amazon.com/images/M/MV5BYWUxZjJkMDktZmMxMS00Mzg3LTk4MDItN2IwODlmN2E0MTM0XkEyXkFqcGdeQXVyMTMxODk2OTU@._V1_UX140_CR0,0,140,209_AL_.jpg"
288,Sing Street,2016,106,"['Comedy', ' Drama', ' Music']",John Carney,7.9,A boy growing up in Dublin during the 1980s escapes his strained family life by starting a band to impress the mysterious girl he likes.,"https://m.media-amazon.com/images/M/MV5BMjEzODA3MDcxMl5BMl5BanBnXkFtZTgwODgxNDk3NzE@._V1_UY209_CR0,0,140,209_AL_.jpg"
289,Belle de jour,1967,100,"['Drama', ' Romance']",Luis Buñuel,7.6,A frigid young housewife decides to spend her midweek afternoons as a prostitute.,"https://m.media-amazon.com/images/M/MV5BYjJiMGEwYTQtOGM0Ni00ZDQ0LThlNWItNzgwNTBlYmE1YzdjXkEyXkFqcGdeQXVyMTUzMDUzNTI3._V1_UX140_CR0,0,140,209_AL_.jpg"
290,The Straight Story,1999,112,"['Biography', ' Drama']",David Lynch,8.0,An old man makes a long journey by lawnmower to mend his relationship with an ill brother.,"https://m.media-amazon.com/images/M/MV5BM2UxYTMwMWUtOGM1OS00MDI4LWFhNTUtOTA4NWI2ZjEwNmMxXkEyXkFqcGdeQXVyMjUzOTY1NTc@._V1_UY209_CR0,0,140,209_AL_.jpg"
291,Double Indemnity,1944,107,"['Crime', ' Drama', ' Film-Noir']",Billy Wilder,8.3,"A Los Angeles insurance representative lets an alluring housewife seduce him into a scheme of insurance fraud and murder that arouses the suspicion of his colleague, an insurance investigator.","https://m.media-amazon.com/images/M/MV5BOTdlNjgyZGUtOTczYi00MDdhLTljZmMtYTEwZmRiOWFkYjRhXkEyXkFqcGdeQXVyNDY2MTk1ODk@._V1_UX140_CR0,0,140,209_AL_.jpg"
292,"Aguirre, der Zorn Gottes",1972,95,"['Action', ' Adventure', ' Biography']",Werner Herzog,7.8,"In the 16th century, the ruthless and insane Don Lope de Aguirre leads a Spanish expedition in search of El Dorado.","https://m.media-amazon.com/images/M/MV5BMjRkY2VhYzMtZWQyNS00OTY2LWE5NTAtYjlhNmQyYzE5MmUxXkEyXkFqcGdeQXVyMTQxNzMzNDI@._V1_UX140_CR0,0,140,209_AL_.jpg"
293,Adam's Rib,1949,101,"['Comedy', ' Romance']",George Cukor,7.4,Domestic and professional tensions mount when a husband and wife work as opposing lawyers in a case involving a woman who shot her husband.,"https://m.media-amazon.com/images/M/MV5BNmEyY2ExYTMtN2VmNi00MTMwLWE3MmQtZDM1NDAxNDdhZDRlXkEyXkFqcGdeQXVyMDI2NDg0NQ@@._V1_UY209_CR1,0,140,209_AL_.jpg"
294,Lucky,I 2017,88,"['Comedy', ' Drama', ' Western']",John Carroll Lynch,7.3,Lucky follows the spiritual journey of a 90-year-old atheist and the quirky characters that inhabit his off the map desert town.,"https://m.media-amazon.com/images/M/MV5BMDc2MWYzMzMtZTU3NC00M2M4LWI4NGQtOTgyNzc5Nzk5NTQ5XkEyXkFqcGdeQXVyMTg2NTc4MzA@._V1_UX140_CR0,0,140,209_AL_.jpg"
295,Pinocchio,1940,88,"['Animation', ' Adventure', ' Comedy']",Norman Ferguson,7.5,"A living puppet, with the help of a cricket as his conscience, must prove himself worthy to become a real boy.","https://m.media-amazon.com/images/M/MV5BMTU4Mzk3ODIyOF5BMl5BanBnXkFtZTgwODgyNzk2NjE@._V1_UX140_CR0,0,140,209_AL_.jpg"
296,Paterson,2016,118,"['Comedy', ' Drama', ' Romance']",Jim Jarmusch,7.3,"A quiet observation of the triumphs and defeats of daily life, along with the poetry evident in its smallest details.","https://m.media-amazon.com/images/M/MV5BMTUzODA4Nzk0OF5BMl5BanBnXkFtZTgwNzE1MDIwMDI@._V1_UY209_CR0,0,140,209_AL_.jpg"
297,Eighth Grade,2018,93,"['Comedy', ' Drama']",Bo Burnham,7.4,An introverted teenage girl tries to survive the last week of her disastrous eighth grade year before leaving to start high school.,"https://m.media-amazon.com/images/M/MV5BMzVlYzgxYjAtYzhhZi00MDc1LTlkZDMtMTRhZWI0MTg5YTRjXkEyXkFqcGdeQXVyNTAzMTY4MDA@._V1_UX140_CR0,0,140,209_AL_.jpg"
298,Bride of Frankenstein,1935,75,"['Drama', ' Horror', ' Sci-Fi']",James Whale,7.8,"Mary Shelley reveals the main characters of her novel survived: Baron Henry Frankenstein, goaded by an even madder scientist, builds his monster a mate.","https://m.media-amazon.com/images/M/MV5BNzA0MjNiNzgtZWNhZC00MjI3LWI5ZjQtMWJjNTRhMGQzODU1XkEyXkFqcGdeQXVyODIzNDA3NTQ@._V1_UY209_CR0,0,140,209_AL_.jpg"
299,The Night of the Hunter,1955,92,"['Crime', ' Drama', ' Film-Noir']",Charles Laughton,8.0,"A self-proclaimed preacher marries a gullible widow whose young children are reluctant to tell him where their real dad hid the $10,000 he'd stolen in a robbery.","https://m.media-amazon.com/images/M/MV5BMDhjNzhmMTMtZTRkOC00NTdjLTg3N2ItZmQ1ZDU0NGY5OTk5XkEyXkFqcGdeQXVyNDY2MTk1ODk@._V1_UY209_CR1,0,140,209_AL_.jpg"
300,Mommy,I 2014,139,['Drama'],Xavier Dolan,8.0,"A widowed single mother, raising her violent son alone, finds new hope when a mysterious neighbor inserts herself into their household.","https://m.media-amazon.com/images/M/MV5BMGI3YWFmNDQtNjc0Ny00ZDBjLThlNjYtZTc1ZTk5MzU2YTVjXkEyXkFqcGdeQXVyNzA4ODc3ODU@._V1_UY209_CR4,0,140,209_AL_.jpg"
301,Rashômon,1950,88,"['Crime', ' Drama', ' Mystery']",Akira Kurosawa,8.2,"The rape of a bride and the murder of her samurai husband are recalled from the perspectives of a bandit, the bride, the samurai's ghost and a woodcutter.","https://m.media-amazon.com/images/M/MV5BMjEzMzA4NDE2OF5BMl5BanBnXkFtZTcwNTc5MDI2NQ@@._V1_UY209_CR0,0,140,209_AL_.jpg"
302,The Killing,1956,84,"['Crime', ' Drama', ' Film-Noir']",Stanley Kubrick,7.9,Crook Johnny Clay assembles a five-man team to plan and execute a daring racetrack robbery.,"https://m.media-amazon.com/images/M/MV5BNzRhNTI5ZTAtOTNmMC00ODkzLWEwNmMtY2NkMDE4NjIwMWJlXkEyXkFqcGdeQXVyNjc5NjEzNA@@._V1_UX140_CR0,0,140,209_AL_.jpg"
303,Spoorloos,1988,107,"['Mystery', ' Thriller']",George Sluizer,7.7,"Rex and Saskia, a young couple in love, are on vacation. They stop at a busy service station and Saskia is abducted. After three years and no sign of Saskia, Rex begins receiving letters from the abductor.","https://m.media-amazon.com/images/M/MV5BNzczMWJlYTktMjJiZS00Y2ZjLTlhMWItMDg2NWFmZDY3YjdiXkEyXkFqcGdeQXVyNjUxMDQ0MTg@._V1_UX140_CR0,0,140,209_AL_.jpg"
304,The Lady Vanishes,1938,96,"['Mystery', ' Thriller']",Alfred Hitchcock,7.7,"While travelling in continental Europe, a rich young playgirl realizes that an elderly lady seems to have disappeared from the train.","https://m.media-amazon.com/images/M/MV5BNjk3YzFjYTktOGY0ZS00Y2EwLTk2NTctYTI1Nzc2OWNiN2I4XkEyXkFqcGdeQXVyNzM0MTUwNTY@._V1_UY209_CR0,0,140,209_AL_.jpg"
305,The African Queen,1951,105,"['Adventure', ' Drama', ' Romance']",John Huston,7.7,"In WWI East Africa, a gin-swilling Canadian riverboat captain is persuaded by a strait-laced English missionary to undertake a trip up a treacherous river and use his boat to attack a German gunship.","https://m.media-amazon.com/images/M/MV5BYTRkMDVlMjEtMzY1Yy00NTg5LWFlMDQtNmYzY2U2YzdhMTViXkEyXkFqcGdeQXVyNjc5NjEzNA@@._V1_UX140_CR0,0,140,209_AL_.jpg"
306,The Killing Fields,1984,141,"['Biography', ' Drama', ' History']",Roland Joffé,7.8,"A journalist is trapped in Cambodia during tyrant Pol Pot's bloody 'Year Zero' cleansing campaign, which claimed the lives of two million 'undesirable' civilians.","https://m.media-amazon.com/images/M/MV5BZTMxYjBjOTktYWY5OC00NmYwLWE2NTctYzlkMTFkODYxMzRkXkEyXkFqcGdeQXVyMjUzOTY1NTc@._V1_UX140_CR0,0,140,209_AL_.jpg"
307,McCabe & Mrs. Miller,1971,120,"['Drama', ' Western']",Robert Altman,7.6,"A gambler and a prostitute become business partners in a remote Old West mining town, and their enterprise thrives until a large corporation arrives on the scene.","https://m.media-amazon.com/images/M/MV5BMmMxMTk0MmMtY2I0YS00NjcwLTk2NjYtOWFlOTA0M2EzNjgxL2ltYWdlL2ltYWdlXkEyXkFqcGdeQXVyMTQxNzMzNDI@._V1_UX140_CR0,0,140,209_AL_.jpg"
308,Festen,1998,105,['Drama'],Thomas Vinterberg,8.0,"At Helge's 60th birthday party, some unpleasant family truths are revealed.","https://m.media-amazon.com/images/M/MV5BNzA5OWI3MGItMGU0OC00MDZkLWJiMDktOWJjZmFkYmEwZDkzXkEyXkFqcGdeQXVyNTk5Nzg1NjQ@._V1_UY209_CR4,0,140,209_AL_.jpg"
309,Patton,1970,172,"['Biography', ' Drama', ' War']",Franklin J. Schaffner,7.9,The World War II phase of the career of controversial American general George S. Patton.,"https://m.media-amazon.com/images/M/MV5BZmRlMWFhMzMtNTJiNi00ZDdlLTgxMmYtOWVjOGUxNTFhYzU3XkEyXkFqcGdeQXVyMTUzMDUzNTI3._V1_UX140_CR0,0,140,209_AL_.jpg"
310,Frankenstein,1931,70,"['Drama', ' Horror', ' Sci-Fi']",James Whale,7.8,Dr Henry Frankenstein is obsessed with assembling a living being from parts of several exhumed corpses.,"https://m.media-amazon.com/images/M/MV5BMTQ0Njc1MjM0OF5BMl5BanBnXkFtZTgwNTY2NTUyMjE@._V1_UX140_CR0,0,140,209_AL_.jpg"
311,Stop Making Sense,1984,88,"['Documentary', ' Music']",Jonathan Demme,8.7,"Considered by critics as the greatest concert film of all time, the live performance was shot over the course of three nights at Hollywood's Pantages Theater in December of 1983 and features Talking Heads' most memorable songs.","https://m.media-amazon.com/images/M/MV5BZTkyY2UzNGMtOTE3My00OWE0LThmMjItZTVhNDQ5YzcxN2YxXkEyXkFqcGdeQXVyMTcwOTQzOTYy._V1_UX140_CR0,0,140,209_AL_.jpg"
312,The Great Dictator,1940,125,"['Comedy', ' Drama', ' War']",Charles Chaplin,8.4,Dictator Adenoid Hynkel tries to expand his empire while a poor Jewish barber tries to avoid persecution from Hynkel's regime.,"https://m.media-amazon.com/images/M/MV5BMmExYWJjNTktNGUyZS00ODhmLTkxYzAtNWIzOGEyMGNiMmUwXkEyXkFqcGdeQXVyNjU0OTQ0OTY@._V1_UY209_CR0,0,140,209_AL_.jpg"
313,"Shin seiki Evangelion Gekijô-ban: Air/Magokoro wo, kimi ni",1997,87,"['Animation', ' Action', ' Drama']",Hideaki Anno,8.1,Concurrent theatrical ending of the TV series Shinseiki Evangelion (1995).,"https://m.media-amazon.com/images/M/MV5BMjU0MzQwMmMtMWU3OS00MDc0LWIzOTItZmE1MjZlYmExMGJiXkEyXkFqcGdeQXVyNzI1NzMxNzM@._V1_UY209_CR0,0,140,209_AL_.jpg"
314,Dare mo shiranai,2004,141,['Drama'],Kore-eda Hirokazu,8.0,"In a small Tokyo apartment, twelve-year-old Akira must care for his younger siblings after their mother leaves them and shows no sign of returning.","https://m.media-amazon.com/images/M/MV5BMjE5ZTA2YzQtM2M0My00OGNkLWE2YTAtYzA3YWE2YTQ0OWJmXkEyXkFqcGdeQXVyMTI3ODAyMzE2._V1_UY209_CR4,0,140,209_AL_.jpg"
315,Les quatre cents coups,1959,99,"['Crime', ' Drama']",François Truffaut,8.1,"A young boy, left without attention, delves into a life of petty crime.","https://m.media-amazon.com/images/M/MV5BYTQ4MjA4NmYtYjRhNi00MTEwLTg0NjgtNjk3ODJlZGU4NjRkL2ltYWdlL2ltYWdlXkEyXkFqcGdeQXVyNjU0OTQ0OTY@._V1_UY209_CR8,0,140,209_AL_.jpg"
316,Ladri di biciclette,1948,89,['Drama'],Vittorio De Sica,8.3,"In post-war Italy, a working-class man's bicycle is stolen, endangering his efforts to find work. He and his son set out to find it.","https://m.media-amazon.com/images/M/MV5BNmI1ODdjODctMDlmMC00ZWViLWI5MzYtYzRhNDdjYmM3MzFjXkEyXkFqcGdeQXVyMTMxODk2OTU@._V1_UY209_CR2,0,140,209_AL_.jpg"
317,Dekalog,1989–1990,572,['Drama'],Artur Barcis,8.9,"Ten television drama films, each one based on one of the Ten Commandments.","https://m.media-amazon.com/images/M/MV5BNDgzZDVmZjYtYmNhNi00YTE0LWJmNDAtODZiNWIwMjJhZDhhXkEyXkFqcGdeQXVyNjAwNDUxODI@._V1_UX140_CR0,0,140,209_AL_.jpg"
318,Local Hero,1983,111,"['Comedy', ' Drama']",Bill Forsyth,7.3,"An American oil company has plans for a new refinery and sends someone to Scotland to buy up an entire village, but things don't go as expected.","https://m.media-amazon.com/images/M/MV5BNjAxOGVjZjktNjc1Ny00NGYyLWEwYWUtNDZhMDJmZmQzMjIzXkEyXkFqcGdeQXVyNjc5NjEzNA@@._V1_UX140_CR0,0,140,209_AL_.jpg"
319,Trois couleurs: Bleu,1993,94,"['Drama', ' Music', ' Mystery']",Krzysztof Kieslowski,7.9,A woman struggles to find a way to live her life after the death of her husband and child.,"https://m.media-amazon.com/images/M/MV5BZWU5NWQ2MWMtYmI4Ni00Yjk5LTk3ODktMDVlZGViNGUwN2M5XkEyXkFqcGdeQXVyNTAyODkwOQ@@._V1_UX140_CR0,0,140,209_AL_.jpg"
320,Strangers on a Train,1951,101,"['Crime', ' Drama', ' Film-Noir']",Alfred Hitchcock,7.9,A psychopathic man tries to forcibly persuade a tennis star to agree to his theory that two strangers can get away with murder by submitting to his plan to kill the other's most-hated person.,"https://m.media-amazon.com/images/M/MV5BNWJjOGM4NmEtNDE2YS00OGEyLTkwZWItMGM4YzdhZDZhMzNhXkEyXkFqcGdeQXVyMDI2NDg0NQ@@._V1_UX140_CR0,0,140,209_AL_.jpg"
321,All Quiet on the Western Front,1930,152,"['Drama', ' War']",Lewis Milestone,8.1,"A German youth eagerly enters World War I, but his enthusiasm wanes as he gets a firsthand view of the horror.","https://m.media-amazon.com/images/M/MV5BMDdlMzRjM2MtNjcxNy00MjgyLTkyZmYtY2ExODM0OTBkMzI0XkEyXkFqcGdeQXVyMzg1ODEwNQ@@._V1_UX140_CR0,0,140,209_AL_.jpg"
322,Freaks,1932,64,"['Drama', ' Horror']",Tod Browning,7.8,"A circus' beautiful trapeze artist agrees to marry the leader of side-show performers, but his deformed friends discover she is only marrying him for his inheritance.","https://m.media-amazon.com/images/M/MV5BMjMyYjgyOTQtZDVlZS00NTQ0LWJiNDItNGRlZmM3Yzc0N2Y0XkEyXkFqcGdeQXVyNTA4NzY1MzY@._V1_UX140_CR0,0,140,209_AL_.jpg"
323,Manhattan,1979,96,"['Comedy', ' Drama', ' Romance']",Woody Allen,7.8,The life of a divorced television writer dating a teenage girl is further complicated when he falls in love with his best friend's mistress.,"https://m.media-amazon.com/images/M/MV5BZGE2NjI5MjAtODQwYy00OGJkLWJiZTEtMTU0NzVlMTkzNjFjXkEyXkFqcGdeQXVyMTUzMDUzNTI3._V1_UX140_CR0,0,140,209_AL_.jpg"
324,Vuelven,2017,83,"['Fantasy', ' Horror', ' Mystery']",Issa López,6.9,A dark fairy tale about a gang of five children trying to survive the horrific violence of the cartels and the ghosts created every day by the drug war.,"https://m.media-amazon.com/images/M/MV5BMTMyN2Q5ODYtMWI3OC00NjBjLWIyYTItNGE5NGJiYzI4NjNjXkEyXkFqcGdeQXVyNDc3MzM3MQ@@._V1_UY209_CR3,0,140,209_AL_.jpg"
325,Paper Moon,1973,102,"['Comedy', ' Crime', ' Drama']",Peter Bogdanovich,8.1,"During the Great Depression, a con man finds himself saddled with a young girl who may or may not be his daughter, and the two forge an unlikely partnership.","https://m.media-amazon.com/images/M/MV5BOWVmYzQwY2MtOTBjNi00MDNhLWI5OGMtN2RiMDYxODI3MjU5XkEyXkFqcGdeQXVyMjUzOTY1NTc@._V1_UX140_CR0,0,140,209_AL_.jpg"
326,God's Own Country,2017,104,"['Drama', ' Romance']",Francis Lee,7.6,"Spring. Yorkshire. Young farmer Johnny Saxby numbs his daily frustrations with binge drinking and casual sex, until the arrival of a Romanian migrant worker for lambing season ignites an intense relationship that sets Johnny on a new path.","https://m.media-amazon.com/images/M/MV5BNjRhYzk2NDAtYzA1Mi00MmNmLWE1ZjQtMDBhZmUyMTdjZjBiXkEyXkFqcGdeQXVyNjk1Njg5NTA@._V1_UY209_CR0,0,140,209_AL_.jpg"
327,Anatomy of a Murder,1959,161,"['Drama', ' Mystery']",Otto Preminger,8.0,"An upstate Michigan lawyer defends a soldier who claims he killed an innkeeper due to temporary insanity after the victim raped his wife. What is the truth, and will he win his case?","https://m.media-amazon.com/images/M/MV5BNzIzZTNlZmUtMWY0YS00MjY2LTg2NjUtNTZhMzQ0MTUyMDYxXkEyXkFqcGdeQXVyNjc5NjEzNA@@._V1_UY209_CR0,0,140,209_AL_.jpg"
328,Mary and Max.,2009,92,"['Animation', ' Comedy', ' Drama']",Adam Elliot,8.1,"In 1976 Melbourne, a lonely 8-year-old girl strikes up a correspondence with an unlikely pen pal: a severely obese 44-year-old New Yorker with Asperger's syndrome.","https://m.media-amazon.com/images/M/MV5BMDgzYjQwMDMtNGUzYi00MTRmLWIyMGMtNjE1OGZkNzY2YWIzL2ltYWdlXkEyXkFqcGdeQXVyNjU0OTQ0OTY@._V1_UY209_CR3,0,140,209_AL_.jpg"
329,Columbus,I 2017,104,['Drama'],Kogonada,7.2,"A Korean-born man finds himself stuck in Columbus, Indiana, where his architect father is in a coma. The man meets a young woman who wants to stay in Columbus with her mother, a recovering addict, instead of pursuing her own dreams.","https://m.media-amazon.com/images/M/MV5BNWJiNzBlNjAtYjgwOC00YjZmLWI0YzItNTI1MzY4NmE4ZGI1XkEyXkFqcGdeQXVyODc0OTEyNDU@._V1_UY209_CR0,0,140,209_AL_.jpg"
330,Short Term 12,2013,96,['Drama'],Destin Daniel Cretton,7.9,A 20-something supervising staff member of a residential treatment facility navigates the troubled waters of that world alongside her co-worker and longtime boyfriend.,"https://m.media-amazon.com/images/M/MV5BNzQ1MjQzMzM3OF5BMl5BanBnXkFtZTcwMzg3NzQ3OQ@@._V1_UY209_CR0,0,140,209_AL_.jpg"
331,The Manchurian Candidate,1962,126,"['Drama', ' Thriller']",John Frankenheimer,7.9,An American POW in the Korean War is brainwashed as an unwitting assassin for an international Communist conspiracy.,"https://m.media-amazon.com/images/M/MV5BOTY0ZTA1ZjUtN2MyNi00ZGRmLWExYmMtOTkyNzI1NGQ2Y2RlXkEyXkFqcGdeQXVyNjc1NTYyMjg@._V1_UX140_CR0,0,140,209_AL_.jpg"
332,Das Cabinet des Dr. Caligari,1920,76,"['Horror', ' Mystery', ' Thriller']",Robert Wiene,8.0,"Hypnotist Dr. Caligari uses a somnambulist, Cesare, to commit murders.","https://m.media-amazon.com/images/M/MV5BNWJiNGJiMTEtMGM3OC00ZWNlLTgwZTgtMzdhNTRiZjk5MTQ1XkEyXkFqcGdeQXVyMTMxODk2OTU@._V1_UY209_CR3,0,140,209_AL_.jpg"
333,Picnic at Hanging Rock,1975,115,"['Drama', ' Mystery']",Peter Weir,7.4,"During a rural summer picnic, a few students and a teacher from an Australian girls' school vanish without a trace. Their absence frustrates and haunts the people left behind.","https://m.media-amazon.com/images/M/MV5BNzk4NTljZDEtNDk0Ny00ODkxLWExMzItODVlODc4MDUxN2JkXkEyXkFqcGdeQXVyMTMxMTY0OTQ@._V1_UY209_CR0,0,140,209_AL_.jpg"
334,You Can Count on Me,2000,111,['Drama'],Kenneth Lonergan,7.5,"A single mother's life is thrown into turmoil after her struggling, rarely seen younger brother returns to town.","https://m.media-amazon.com/images/M/MV5BZTNmZGNkODUtZWZhMi00NGMwLWEzZWMtNTEzNzU3ZmUxNWZmXkEyXkFqcGdeQXVyMTAwMzUyOTc@._V1_UY209_CR0,0,140,209_AL_.jpg"
335,Peeping Tom,1960,101,"['Drama', ' Horror', ' Thriller']",Michael Powell,7.6,"A young man murders women, using a movie camera to film their dying expressions of terror.","https://m.media-amazon.com/images/M/MV5BYWU1ZDc0YjMtNjFhYS00NGZiLTk2MzgtNmU0Mzk3ZjdkMTA2XkEyXkFqcGdeQXVyNDE0OTU3NDY@._V1_UY209_CR0,0,140,209_AL_.jpg"
336,If Beale Street Could Talk,2018,119,"['Drama', ' Romance']",Barry Jenkins,7.1,A young woman embraces her pregnancy while she and her family set out to prove her childhood friend and lover innocent of a crime he didn't commit.,"https://m.media-amazon.com/images/M/MV5BZWVkMzY5NzgtMTdlNS00NjY5LThjOTktZWFkNDU3NmQzMDIwXkEyXkFqcGdeQXVyODk2NDQ3MTA@._V1_UY209_CR0,0,140,209_AL_.jpg"
337,The Ghost and Mrs. Muir,1947,104,"['Comedy', ' Drama', ' Fantasy']",Joseph L. Mankiewicz,7.8,"In 1900, a young widow finds her seaside cottage is haunted and forms a unique relationship with the ghost.","https://m.media-amazon.com/images/M/MV5BNzYxMjIyMmYtMDI2OS00YTgyLWExZWMtODdkZTk1NzRlODgzXkEyXkFqcGdeQXVyMTAwMzUyOTc@._V1_UY209_CR1,0,140,209_AL_.jpg"
338,City Lights,1931,87,"['Comedy', ' Drama', ' Romance']",Charles Chaplin,8.5,"With the aid of a wealthy erratic tippler, a dewy-eyed tramp who has fallen in love with a sightless flower girl accumulates money to be able to help her medically.","https://m.media-amazon.com/images/M/MV5BY2I4MmM1N2EtM2YzOS00OWUzLTkzYzctNDc5NDg2N2IyODJmXkEyXkFqcGdeQXVyNzkwMjQ5NzM@._V1_UX140_CR0,0,140,209_AL_.jpg"
339,Yôjinbô,1961,110,"['Action', ' Drama', ' Thriller']",Akira Kurosawa,8.2,A crafty ronin comes to a town divided by two criminal gangs and decides to play them against each other to free the town.,"https://m.media-amazon.com/images/M/MV5BZThiZjAzZjgtNDU3MC00YThhLThjYWUtZGRkYjc2ZWZlOTVjXkEyXkFqcGdeQXVyNTA4NzY1MzY@._V1_UX140_CR0,0,140,209_AL_.jpg"
