,Movie Name,Year of Release,Duration (Min),Genres,Director,Movie Rating,Description,Photo URL
689,Young Mr. Lincoln,1939,100,"['Biography', ' Drama', ' History']",John Ford,7.5,A fictionalized account of the early life of the American president as a young lawyer facing his greatest court case.,"https://m.media-amazon.com/images/M/MV5BZjhhMDVhMDEtY2IzNi00MTg2LWIyYzMtYWY4YzliZDA3ZGQ3XkEyXkFqcGdeQXVyMDI2NDg0NQ@@._V1_UY209_CR0,0,140,209_AL_.jpg"
690,The Unknown,1927,68,"['Drama', ' Horror', ' Romance']",Tod Browning,7.7,A criminal on the run hides in a circus and seeks to possess the daughter of the ringmaster at any cost.,"https://m.media-amazon.com/images/M/MV5BMDgzNjQ4Y2MtNDhiOS00NTcwLWIyMzMtYmExYjAzZGM2Yjc0XkEyXkFqcGdeQXVyMzg1ODEwNQ@@._V1_UX140_CR0,0,140,209_AL_.jpg"
691,Les enfants du paradis,1945,189,"['Drama', ' Romance']",Marcel Carné,8.3,The theatrical life of a beautiful courtesan in 1830s Paris and the four men who love her.,"https://m.media-amazon.com/images/M/MV5BZjVjYTAzYjctZTZkNi00NmNhLWJkY2UtNjEyOWQ5NTI0MmEzXkEyXkFqcGdeQXVyNDE5MTU2MDE@._V1_UY209_CR2,0,140,209_AL_.jpg"
692,Twenty Feet from Stardom,2013,91,"['Documentary', ' Biography', ' History']",Morgan Neville,7.4,"Backup singers live in a world that lies just beyond the spotlight. Their voices bring harmony to the biggest bands in popular music, but we've had no idea who these singers are or what lives they lead, until now.","https://m.media-amazon.com/images/M/MV5BMTQxNDY2NjMwNF5BMl5BanBnXkFtZTcwNzExMDg0OQ@@._V1_UY209_CR0,0,140,209_AL_.jpg"
693,Tristana,1970,99,['Drama'],Luis Buñuel,7.4,"Shortly after her mother's death, an innocent and youthful woman will find refuge into the household of her middle-aged aristocratic guardian, who will submit her to his sexual advances.","https://m.media-amazon.com/images/M/MV5BNWQ1NWY1OTctYmJkMy00OTdlLTkwZGItMDgxYjZkNTAzNDU5XkEyXkFqcGdeQXVyMjUzOTY1NTc@._V1_UX140_CR0,0,140,209_AL_.jpg"
694,L'âge d'or,1930,60,"['Comedy', ' Drama']",Luis Buñuel,7.2,"A surrealist tale of a man and a woman who are passionately in love with each other, but their attempts to consummate that passion are constantly thwarted by their families, the Church, and bourgeois society.","https://m.media-amazon.com/images/M/MV5BOTQ1MWRmODYtZWYyNS00YTE0LWE3OWEtZTkxNzdjNzRjZWNhXkEyXkFqcGdeQXVyNTcwNjUwNzk@._V1_UY209_CR1,0,140,209_AL_.jpg"
695,Lola,1981,115,"['Drama', ' Romance']",Rainer Werner Fassbinder,7.4,"A seductive cabaret singer-prostitute pits a corrupt building contractor against the new straight-arrow building commissioner, launching an outrageous plan to elevate herself in a world where everything-and everyone-is for sale.","https://m.media-amazon.com/images/M/MV5BY2Q2YjIwMGEtZGEyMy00ZmJhLTkwYjQtMTdhYTdlYzViM2E0XkEyXkFqcGdeQXVyMjUzOTY1NTc@._V1_UX140_CR0,0,140,209_AL_.jpg"
696,Orphée,1950,112,"['Drama', ' Fantasy', ' Romance']",Jean Cocteau,7.9,A poet in love with Death follows his unhappy wife into the underworld.,"https://m.media-amazon.com/images/M/MV5BMTUwMjUwMTY2MV5BMl5BanBnXkFtZTgwNzA2MDM5MTE@._V1_UY209_CR7,0,140,209_AL_.jpg"
697,L'argent,1983,85,"['Crime', ' Drama']",Robert Bresson,7.4,A counterfeit bill that starts off as a schoolboy prank leads to incarceration and violence.,"https://m.media-amazon.com/images/M/MV5BYTk4YTJkMGUtOTJkYi00MGJjLThhODctOGJlNTI5YzI0ZDM4XkEyXkFqcGdeQXVyMjUzOTY1NTc@._V1_UX140_CR0,0,140,209_AL_.jpg"
698,Visages villages,2017,94,['Documentary'],JR,7.8,Director Agnes Varda and photographer/muralist J.R. journey through rural France and form an unlikely friendship.,"https://m.media-amazon.com/images/M/MV5BMmUwMzJkODEtOTZjNy00ZWNkLWE4ZDItYzcyYzA2OGJhMjYwXkEyXkFqcGdeQXVyNjc0MzY3NTA@._V1_UY209_CR0,0,140,209_AL_.jpg"
699,7 Men from Now,1956,78,['Western'],Budd Boetticher,7.4,A former sheriff blames himself for his wife's death during a Wells Fargo robbery and vows to track down and kill the seven men responsible.,"https://m.media-amazon.com/images/M/MV5BYWQ0MDQwMmUtZWJmOS00N2MzLThjNzUtNjI0NTdlMTkzMmNjXkEyXkFqcGdeQXVyNjc5NjEzNA@@._V1_UX140_CR0,0,140,209_AL_.jpg"
700,This Happy Breed,1944,115,"['Comedy', ' Drama']",David Lean,7.3,"Just after World War I, the Gibbons family moves to a nice house in the suburbs. They live an ordinary life throughout the years, but everything changes when World War II breaks out.","https://m.media-amazon.com/images/M/MV5BYWJiNTU1MzctYzg0YS00ZWJjLWIwZDEtNzk0ZTUwNmFmMDE3L2ltYWdlL2ltYWdlXkEyXkFqcGdeQXVyNjc1NTYyMjg@._V1_UX140_CR0,0,140,209_AL_.jpg"
701,Divorzio all'italiana,1961,105,"['Comedy', ' Drama', ' Romance']",Pietro Germi,8.0,"A married Sicilian baron falls in love with his cousin and vows to wed her, but with divorce illegal he must concoct a crime of passion to do away with his wife.","https://m.media-amazon.com/images/M/MV5BZGNiODA2YmMtY2NkMi00MGQxLWFhYmYtNmQ0MzAxZTliNzkyXkEyXkFqcGdeQXVyMTU3NDU4MDg2._V1_UX140_CR0,0,140,209_AL_.jpg"
702,Housekeeping,1987,116,"['Comedy', ' Drama']",Bill Forsyth,7.1,"After their mother commits suicide, two sisters end up living with their kind but peculiar aunt in their grandmother's old house in a small 1950s town.","https://m.media-amazon.com/images/M/MV5BY2NiNmYwMjktZTQ0ZS00MGE5LTk1NTQtNjNmNTQ0YTMwNzM5XkEyXkFqcGdeQXVyNjMwMjk0MTQ@._V1_UY209_CR0,0,140,209_AL_.jpg"
703,Qingshaonian Nuozha,1992,106,"['Crime', ' Drama', ' Romance']",Tsai Ming-liang,7.5,"Within the urban gloom of Taipei, four youths face alienation, loneliness, and moments of existential crisis amidst a series of minor crimes.","https://m.media-amazon.com/images/M/MV5BODkxNjgwNjk0MF5BMl5BanBnXkFtZTgwNzM0NjA5NDE@._V1_UY209_CR1,0,140,209_AL_.jpg"
704,'Round Midnight,1986,133,"['Drama', ' Music']",Bertrand Tavernier,7.4,"A troubled, but talented musician flees the US to escape his problems, finding refuge and support in Paris.","https://m.media-amazon.com/images/M/MV5BNTQ0MzI0NTQtM2Q1NC00OGY3LTg3NjEtZWRiOTQ2Y2UyNTcxXkEyXkFqcGdeQXVyMTQxNzMzNDI@._V1_UX140_CR0,0,140,209_AL_.jpg"
705,Trouble in Paradise,1932,83,"['Comedy', ' Crime', ' Romance']",Ernst Lubitsch,7.9,A gentleman thief and a lady pickpocket join forces to con a beautiful perfume company owner. Romantic entanglements and jealousies confuse the scheme.,"https://m.media-amazon.com/images/M/MV5BY2E5ODgyYmQtY2Q0ZS00N2MyLWJhYzktYTliMWEyOWM2OGNiXkEyXkFqcGdeQXVyMDI2NDg0NQ@@._V1_UY209_CR6,0,140,209_AL_.jpg"
706,Fat City,1972,96,"['Drama', ' Sport']",John Huston,7.3,"Two men, working as professional boxers, come to blows when their careers each begin to take different directions.","https://m.media-amazon.com/images/M/MV5BNGU0ZDRlYjYtMjNhMS00ZjQzLTk4ZDMtZjM5OTRlZmQ0OGQyXkEyXkFqcGdeQXVyMTUzMDUzNTI3._V1_UX140_CR0,0,140,209_AL_.jpg"
707,On Dangerous Ground,1951,82,"['Drama', ' Film-Noir']",Nicholas Ray,7.2,"Rough city cop Jim Wilson is disciplined by his captain and is sent upstate, to a snowy mountain town, to help the local sheriff solve a murder case.","https://m.media-amazon.com/images/M/MV5BODA0ZTAzMTgtZmUwYi00Y2YzLWJhZjgtNzdhMDZlZmIwNmQ0XkEyXkFqcGdeQXVyNjc1NTYyMjg@._V1_UX140_CR0,0,140,209_AL_.jpg"
708,Germania anno zero,1948,78,['Drama'],Roberto Rossellini,7.8,A young German boy faces the problems of the tough life in the immediate post-WWII Berlin.,"https://m.media-amazon.com/images/M/MV5BMDRlOWRiMTktYmQ0Zi00ZDRhLWIwNjUtYmM1MDA0MjZiZjlmXkEyXkFqcGdeQXVyMjgyNjk3MzE@._V1_UY209_CR0,0,140,209_AL_.jpg"
709,The War Game,1966 TV Movie,48,"['Drama', ' War']",Peter Watkins,8.0,A docudrama depicting a hypothetical nuclear attack on Britain.,"https://m.media-amazon.com/images/M/MV5BZWRlODdjY2YtYmJhNy00NDE3LWFmOWMtOTUyOWZkOGUyOTI5XkEyXkFqcGdeQXVyMTk0MjQ3Nzk@._V1_UX140_CR0,0,140,209_AL_.jpg"
710,The More the Merrier,1943,104,['Comedy'],George Stevens,7.6,"During the World War II housing shortage in Washington, two men and a woman share a single apartment and the older man plays Cupid to the other two.","https://m.media-amazon.com/images/M/MV5BZDM0NTY2ZTAtZTRjYi00ZDEyLThjMGYtYTRmNjY5NDIwNGFkXkEyXkFqcGdeQXVyNjc1NTYyMjg@._V1_UX140_CR0,0,140,209_AL_.jpg"
711,Sans soleil,1983,104,"['Documentary', ' Drama']",Chris Marker,7.8,"A woman narrates the contemplative writings of a seasoned world traveler, focusing on contemporary Japan.","https://m.media-amazon.com/images/M/MV5BMjc4MzliNDQtYjc2Mi00Y2UxLTk2ZTctOGIzMmY3YjFmN2UyXkEyXkFqcGdeQXVyNDkzNTM2ODg@._V1_UY209_CR3,0,140,209_AL_.jpg"
712,The Gunfighter,1950,85,['Western'],Henry King,7.7,"Notorious gunfighter Jimmy Ringo rides into town to find his true love, who doesn't want to see him. He hasn't come looking for trouble, but trouble finds him around every corner.","https://m.media-amazon.com/images/M/MV5BYjBiNmNiOWUtZTJhYi00N2JkLTgwYWItYTdhMjA0M2VlNGU0XkEyXkFqcGdeQXVyMjI4MjA5MzA@._V1_UX140_CR0,0,140,209_AL_.jpg"
713,Le doulos,1962,108,"['Crime', ' Thriller']",Jean-Pierre Melville,7.7,A burglar betraying other criminals prepares for a big heist with a trusted friend who might be as untrustworthy as he.,"https://m.media-amazon.com/images/M/MV5BMTYxYmE2ZDAtZjlkMC00ZWY3LWIzMmItMGZjMjNkZGRhNWY3XkEyXkFqcGdeQXVyNzYxODE3NTQ@._V1_UY209_CR1,0,140,209_AL_.jpg"
714,This Sporting Life,1963,134,"['Drama', ' Sport']",Lindsay Anderson,7.5,"Despite success on the field, a rising rugby star senses the emerging emptiness of his life as his inner angst begins to materialize through aggression and brutality, so he attempts to woo his landlady in hopes of finding reason to live.","https://m.media-amazon.com/images/M/MV5BMTM1OTYzNjc0OF5BMl5BanBnXkFtZTcwMTEzMzY3NA@@._V1_UX140_CR0,0,140,209_AL_.jpg"
715,Marketa Lazarová,1967,162,"['Drama', ' History', ' Romance']",Frantisek Vlácil,7.9,A grim portrayal of the shift from Paganism to Christianity in medieval central Europe - as a young virgin promised to God is kidnapped and raped by a marauder who her religious father seeks to kill in return.,"https://m.media-amazon.com/images/M/MV5BM2Q0N2VhNGEtYjYyOC00ZmQ5LTk3YTAtOTczNmUxZDUwMGY4XkEyXkFqcGdeQXVyODUwNTM2ODI@._V1_UY209_CR4,0,140,209_AL_.jpg"
716,The Fallen Idol,1948,95,"['Drama', ' Film-Noir', ' Mystery']",Carol Reed,7.6,"A butler working in a foreign embassy in London falls under suspicion when his wife accidentally falls to her death, the only witness being an impressionable young boy.","https://m.media-amazon.com/images/M/MV5BZDM5Y2Q5OGYtNWY0Ny00NTUzLTg1ZWUtNjUxNjM4OThiZWE1XkEyXkFqcGdeQXVyMTU3NDU4MDg2._V1_UX140_CR0,0,140,209_AL_.jpg"
717,Meshes of the Afternoon,1943,14,"['Short', ' Fantasy', ' Mystery']",Maya Deren,7.8,"A woman returning home falls asleep and has vivid dreams that may or may not be happening in reality. Through repetitive images and complete mismatching of the objective view of time and space, her dark inner desires play out on-screen.","https://m.media-amazon.com/images/M/MV5BM2JlMzdhYjktOTY2MC00MTY2LTg0NGYtZjU3YjQ3NTU0MjJhXkEyXkFqcGdeQXVyNjc5NjEzNA@@._V1_UX140_CR0,0,140,209_AL_.jpg"
718,Sanshô dayû,1954,124,['Drama'],Kenji Mizoguchi,8.4,"In medieval Japan, a compassionate governor is sent into exile. His wife and children try to join him, but are separated, and the children grow up amid suffering and oppression.","https://m.media-amazon.com/images/M/MV5BZGU0YmFmMGEtYjVmZi00N2UxLTkxOWMtMzRjZDFhZDQyYzBhXkEyXkFqcGdeQXVyMTIyNzY1NzM@._V1_UY209_CR2,0,140,209_AL_.jpg"
719,The Chronicle History of King Henry the Fifth with His Battell Fought at Agincourt in France,1944,137,"['Biography', ' Drama', ' History']",Laurence Olivier,7.0,"In the midst of the Hundred Years' War, the young King Henry V of England embarks on the conquest of France in 1415.","https://m.media-amazon.com/images/M/MV5BMzg5OGEzMGMtM2E3Zi00Mzk5LWI5N2QtYjhmMTAxNzViNWIyXkEyXkFqcGdeQXVyMTU3NDU4MDg2._V1_UX140_CR0,0,140,209_AL_.jpg"
720,Criss Cross,1949,84,"['Crime', ' Drama', ' Film-Noir']",Robert Siodmak,7.4,An armored truck driver and his ex-wife conspire with a gang to have his own truck robbed on the route.,"https://m.media-amazon.com/images/M/MV5BYmE2NWJjNGItNTE0Ny00M2M0LTk3NTItMjVhMDJlNWM3OTMzXkEyXkFqcGdeQXVyMTA0MTM5NjI2._V1_UX140_CR0,0,140,209_AL_.jpg"
721,Nanjing! Nanjing!,2009,132,"['Drama', ' History', ' War']",Chuan Lu,7.7,"In 1937, Japan occupied Nanjing, the Chinese capital. There was a battle and subsequent atrocities against the inhabitants, especially those who took refuge in the International Security Zone.","https://m.media-amazon.com/images/M/MV5BY2U3YTAwMjQtMmIzNC00MmI0LTliOWEtYTYwMDc1NmU1Mzc3XkEyXkFqcGdeQXVyNzI1NzMxNzM@._V1_UY209_CR1,0,140,209_AL_.jpg"
722,Morocco,1930,92,"['Drama', ' Romance']",Josef von Sternberg,7.0,"A cabaret singer and a Legionnaire fall in love, but their relationship is complicated by the results of his womanizing and the appearance of a rich man who wants her for himself.","https://m.media-amazon.com/images/M/MV5BOWNiYzgxZjMtZTI5NC00MmZkLThkNTgtZGJmZTA0OTZmOGJiXkEyXkFqcGdeQXVyNjc1NTYyMjg@._V1_UX140_CR0,0,140,209_AL_.jpg"
723,Aleksandr Nevskiy,1938,112,"['Action', ' Biography', ' Drama']",Sergei Eisenstein,7.5,The story of how a great Russian prince led a ragtag army to battle an invading force of Teutonic Knights.,"https://m.media-amazon.com/images/M/MV5BOGUwYjdmNDktMWNiMS00MjZmLWE5NDYtOWViZjY4OWMyYTA1XkEyXkFqcGdeQXVyMzg1ODEwNQ@@._V1_UY209_CR8,0,140,209_AL_.jpg"
724,Sweet Sixteen,I 2002,106,"['Crime', ' Drama']",Ken Loach,7.4,"Determined to have a normal family life once his mother gets out of prison, a Scottish teenager from a tough background sets out to raise the money for a home.","https://m.media-amazon.com/images/M/MV5BMjg5MjQ3NjQ5OV5BMl5BanBnXkFtZTYwNDkxNjk5._V1_UY209_CR0,0,140,209_AL_.jpg"
725,Gold Diggers of 1933,1933,97,"['Comedy', ' Drama', ' Musical']",Mervyn LeRoy,7.7,"A wealthy composer rescues unemployed Broadway performers with a new play, but insists on remaining anonymous.","https://m.media-amazon.com/images/M/MV5BMjIyMTQ4MzQwOF5BMl5BanBnXkFtZTgwMzA4NDE1MjE@._V1_UX140_CR0,0,140,209_AL_.jpg"
726,Entre les murs,2008,128,['Drama'],Laurent Cantet,7.5,Teacher and novelist François Bégaudeau plays a version of himself as he negotiates a year with his racially mixed students from a tough Parisian neighborhood.,"https://m.media-amazon.com/images/M/MV5BMTc4NjUzNDYxM15BMl5BanBnXkFtZTcwNjExNzMwMg@@._V1_UY209_CR0,0,140,209_AL_.jpg"
727,Le notti bianche,1957,102,"['Drama', ' Romance']",Luchino Visconti,7.8,A humble clerk courts a woman who awaits her lover's return night after night.,"https://m.media-amazon.com/images/M/MV5BNzU2ZTljMzAtYzYyOS00ZTFiLWIzMmUtM2RkYzhjY2I2YzY1XkEyXkFqcGdeQXVyMzk4OTI2MjM@._V1_UY209_CR0,0,140,209_AL_.jpg"
728,Swing Time,1936,103,"['Comedy', ' Musical', ' Romance']",George Stevens,7.5,"Roguish gambler/dancer ""Lucky"" Garnett is challenged by his fiance's father to come up with $25,000 to prove he's worthy of her hand. But after he falls in love with a dance instructor, Lucky'll do anything to keep from earning the bucks.","https://m.media-amazon.com/images/M/MV5BZWEwNjhlMzYtOGU3Ni00OTg3LWFjOWUtOTg0MDk3M2U0ODk1XkEyXkFqcGdeQXVyMTY5Nzc4MDY@._V1_UX140_CR0,0,140,209_AL_.jpg"
729,L'enfant sauvage,1970,83,"['Biography', ' Drama', ' History']",François Truffaut,7.5,"In a French forest in 1798, a child is found who cannot walk, speak, read or write. A doctor becomes interested in the child and patiently attempts to civilize him.","https://m.media-amazon.com/images/M/MV5BYzgyNTdlMDYtYjQzYS00YWYxLTg2ODUtODQyNTk4ZGQ1MWM5XkEyXkFqcGdeQXVyMjUzOTY1NTc@._V1_UX140_CR0,0,140,209_AL_.jpg"
730,Saturday Night and Sunday Morning,1960,89,"['Drama', ' Romance']",Karel Reisz,7.5,"A rebellious, hard-living factory worker juggles relationships with two women, one of whom is married to another man but pregnant with his child.","https://m.media-amazon.com/images/M/MV5BODc1MGE3ZWUtOTEzYi00NzIxLWIyMjYtZjZkYzhlYWJkOGIyXkEyXkFqcGdeQXVyMTMxMTY0OTQ@._V1_UY209_CR4,0,140,209_AL_.jpg"
731,Magical Girl,2014,127,"['Drama', ' Thriller']",Carlos Vermut,7.2,"The father of a terminally ill girl is determined to grant his daughter's last wish, a ridiculously expensive collectors' costume from a Japanese TV series. The request will drive him into a journey within his city's dark underbelly.","https://m.media-amazon.com/images/M/MV5BNmFkYzQ2MWItM2NkOS00OGFkLThlNjEtOWI5YzVlOTMzY2VmXkEyXkFqcGdeQXVyMTA0MjU0Ng@@._V1_UY209_CR4,0,140,209_AL_.jpg"
732,Beau Geste,1939,112,"['Action', ' Adventure', ' Drama']",William A. Wellman,7.5,Three adopted English brothers join the French Foreign Legion in North Africa after one of them steals their adoptive family's famous heirloom sapphire.,"https://m.media-amazon.com/images/M/MV5BOWQxMzI5ODctNWRlNS00NjRmLWJiZTMtZjliY2I3MWQwMTg0XkEyXkFqcGdeQXVyMDUyOTUyNQ@@._V1_UY209_CR13,0,140,209_AL_.jpg"
733,Week End,1967,105,"['Adventure', ' Comedy', ' Drama']",Jean-Luc Godard,6.9,A surreal tale of a married couple going on a road trip to visit the wife's parents with the intention of killing them for the inheritance.,"https://m.media-amazon.com/images/M/MV5BZjUyMzMwZjctN2ZmOS00NTFlLWI0ZTktZWJhOTI3NjNkOGI0XkEyXkFqcGdeQXVyMjQzMzQzODY@._V1_UY209_CR6,0,140,209_AL_.jpg"
734,Burden of Dreams,1982,95,['Documentary'],Les Blank,7.9,"A documentary following German auteur Werner Herzog as he deals with difficult actors, bad weather and getting a boat over a mountain, all in an effort to make his film Fitzcarraldo (1982).","https://m.media-amazon.com/images/M/MV5BNTcwNWU5YTktNzNjNi00MWUyLThkOWMtNzcwMDBiZmJhN2M3XkEyXkFqcGdeQXVyMjI4MjA5MzA@._V1_UX140_CR0,0,140,209_AL_.jpg"
735,Körkarlen,1921,107,"['Drama', ' Fantasy', ' Horror']",Victor Sjöström,8.0,"On New Year's Eve, the driver of a ghostly carriage forces a drunken man to reflect on his selfish, wasted life.","https://m.media-amazon.com/images/M/MV5BZDJjMzU4N2MtZDkxNi00YmRkLThkZjgtYzRlNzNlYjExNzAwXkEyXkFqcGdeQXVyNzQxNDExNTU@._V1_UX140_CR0,0,140,209_AL_.jpg"
736,Viaggio in Italia,1954,85,"['Drama', ' Romance']",Roberto Rossellini,7.3,An unhappily married couple attempts to find direction and insight while vacationing in Naples.,"https://m.media-amazon.com/images/M/MV5BNWQ1ZGY5MjctNDMyOC00ZGZmLTk0NzUtY2I4ZjJlOWVhODNiL2ltYWdlL2ltYWdlXkEyXkFqcGdeQXVyMjgyNjk3MzE@._V1_UY209_CR0,0,140,209_AL_.jpg"
737,Wagon Master,1950,86,"['Drama', ' Western']",John Ford,7.1,"Two young drifters guide a Mormon wagon train to the San Juan Valley and encounter cutthroats, Indians, geography, and moral challenges on the journey.","https://m.media-amazon.com/images/M/MV5BNjE0M2Y2YmYtNTNlOS00Y2U0LWI5MzItMTk2NTRhNjk0ZmU1L2ltYWdlXkEyXkFqcGdeQXVyNjc1NTYyMjg@._V1_UX140_CR0,0,140,209_AL_.jpg"
738,Madame de...,1953,105,"['Drama', ' Romance']",Max Ophüls,7.9,"When an aristocratic woman known only as ""Madame de . . ."" sells a pair of earrings given to her by her husband in order to pay some debts, she sets off a chain reaction of financial and carnal consequences that can end only in despair.","https://m.media-amazon.com/images/M/MV5BOTUzNGU0MzQtOTQ2ZC00MDViLTk0MzctNTFhOGU4ZTU4YjBkXkEyXkFqcGdeQXVyMDI2NDg0NQ@@._V1_UY209_CR3,0,140,209_AL_.jpg"
739,You Only Live Once,1937,86,"['Crime', ' Drama', ' Film-Noir']",Fritz Lang,7.2,"The public defender's secretary and an ex-convict get married and try to make a life together, but a series of disasters sends their lives spiraling out of control.","https://m.media-amazon.com/images/M/MV5BOTYzZTUxN2EtOWVlYy00ZjMwLWI0NGQtMDNmNWRkNDg5MWJmXkEyXkFqcGdeQXVyMjA0MzYwMDY@._V1_UX140_CR0,0,140,209_AL_.jpg"
740,The Letter,1940,95,"['Crime', ' Drama', ' Film-Noir']",William Wyler,7.5,"The wife of a rubber plantation administrator shoots a man to death and claims it was self-defense, but a letter in her own hand may prove her undoing.","https://m.media-amazon.com/images/M/MV5BNGI1Mjk4ZDgtMDc5ZS00MGI4LWJmZDctNTZkNmQ0NGU0M2JlXkEyXkFqcGdeQXVyMDI2NDg0NQ@@._V1_UY209_CR1,0,140,209_AL_.jpg"
741,Lacombe Lucien,1974,138,"['Drama', ' War']",Louis Malle,7.6,"In 1944, an 18-year old boy from small-town France, collaborates with the Gestapo and subsequently falls in love with a Jewish girl.","https://m.media-amazon.com/images/M/MV5BNDUyMzM2ZmItNTM5Ni00NmQyLTk1YTktYzUyNjZhMWE4ODM0XkEyXkFqcGdeQXVyMjgyNjk3MzE@._V1_UX140_CR0,0,140,209_AL_.jpg"
742,4 aventures de Reinette et Mirabelle,1987,99,"['Comedy', ' Drama', ' Romance']",Éric Rohmer,7.5,Two unlike girls are going to learn each other's world - lovely countryside and bustling Paris.,"https://m.media-amazon.com/images/M/MV5BMTcyNTkyNzE5M15BMl5BanBnXkFtZTgwNzM5Nzg0NDE@._V1_UX140_CR0,0,140,209_AL_.jpg"
743,Letter from an Unknown Woman,1948,87,"['Drama', ' Romance']",Max Ophüls,7.9,"A pianist about to flee from a duel receives a letter from a woman he cannot remember, who may hold the key to his downfall.","https://m.media-amazon.com/images/M/MV5BY2VhMDdlM2UtYjViZi00OWFjLWI5YjUtYjY4NjRjOTJhOGNlXkEyXkFqcGdeQXVyNjc0MzMzNjA@._V1_UX140_CR0,0,140,209_AL_.jpg"
744,Rekopis znaleziony w Saragossie,1965,182,"['Adventure', ' Comedy', ' Drama']",Wojciech Has,7.8,"Upon finding a book that relates his grandfather's story, an officer ventures through Spain meeting a wide array of characters, most of whom have a story of their own to tell.","https://m.media-amazon.com/images/M/MV5BYzZmMjI1MTctOTNkMS00ZTViLWFhMWEtODI5ZWIwMWUxNGIzXkEyXkFqcGdeQXVyMjI4MjA5MzA@._V1_UY209_CR2,0,140,209_AL_.jpg"
745,Im Lauf der Zeit,1976,175,['Drama'],Wim Wenders,7.7,"A traveling projection-equipment mechanic works in Western Germany along the East-German border, visiting worn-out theatres. He meets with a depressed young man whose marriage has just broken up, and the two decide to travel together.","https://m.media-amazon.com/images/M/MV5BM2Q4NmRlOTEtZTYyMy00MzliLWIwYzktMzA4YTU0NmViYWQzXkEyXkFqcGdeQXVyNDkzNTM2ODg@._V1_UY209_CR3,0,140,209_AL_.jpg"
746,Ju Dou,1990,95,"['Drama', ' Romance']",Yimou Zhang,7.6,"In rural China, the young bride of a tyrannical owner of a silk-dyeing business finds temporary solace in the arms of her husband's nephew, but problems arise when she becomes pregnant.","https://m.media-amazon.com/images/M/MV5BNzM5NDA1ZGUtYmY2Yi00YTlkLWFjYzEtMjkwN2E4ZDBlM2FlXkEyXkFqcGdeQXVyMzIzODAxODE@._V1_UY209_CR0,0,140,209_AL_.jpg"
747,Fukushû suru wa ware ni ari,1979,140,"['Crime', ' Drama']",Shôhei Imamura,7.7,"Chronological exploits of Iwao Enokizu, a murderous thief on the run.","https://m.media-amazon.com/images/M/MV5BODA1ZWMyZGMtODhjYS00YWIwLWJhMTgtYWQyMTUzZTkyOTA5XkEyXkFqcGdeQXVyNjYyMTYxMzk@._V1_UY209_CR4,0,140,209_AL_.jpg"
748,Bab el hadid,1958,77,"['Crime', ' Drama']",Youssef Chahine,7.5,A newspaper salesman at the train station in Cairo develops an unhealthy obsession with a woman who sells refreshments.,"https://m.media-amazon.com/images/M/MV5BZDk3YTU5NjgtNjFiOC00ODk5LTgzNjctOGY1NTU1NTdhZTNiXkEyXkFqcGdeQXVyMTA0MTM5NjI2._V1_UX140_CR0,0,140,209_AL_.jpg"
749,I Am a Fugitive from a Chain Gang,1932,92,"['Crime', ' Drama', ' Film-Noir']",Mervyn LeRoy,8.2,"Wrongly convicted James Allen serves in the intolerable conditions of a Southern chain gang, which later comes back to haunt him.","https://m.media-amazon.com/images/M/MV5BMDllMDA4YWQtYzdmNC00OGYxLWE0N2QtZmNjM2QxMTgxYzFkXkEyXkFqcGdeQXVyMDI2NDg0NQ@@._V1_UX140_CR0,0,140,209_AL_.jpg"
750,L'Atalante,1934,89,"['Comedy', ' Drama', ' Romance']",Jean Vigo,7.7,Newly married couple Juliette and a ship captain Jean struggle through marriage as they travel on the L'atalante along with the captain's first mate Le père Jules and a cabin boy.,"https://m.media-amazon.com/images/M/MV5BMGRkOTA2NjYtMDEyOC00MWUxLTkzMjctZmU0MjVjZTQ1MjZlXkEyXkFqcGdeQXVyNDE5MTU2MDE@._V1_UY209_CR2,0,140,209_AL_.jpg"
751,Early Summer,1951,125,"['Drama', ' Romance']",Yasujirô Ozu,8.1,"A family chooses a match for their daughter Noriko, but she, surprisingly, has her own plans.","https://m.media-amazon.com/images/M/MV5BNGE1N2Y4ZmItMWU1Ny00OTg2LTkxNWYtMTg1Y2U0N2ViMzg3XkEyXkFqcGdeQXVyNjc1NTYyMjg@._V1_UY209_CR3,0,140,209_AL_.jpg"
752,Bacalaureat,2016,128,"['Crime', ' Drama']",Cristian Mungiu,7.3,A film about compromises and the implications of the parent's role.,"https://m.media-amazon.com/images/M/MV5BMTc5ODUyNzA3OF5BMl5BanBnXkFtZTgwNjU5OTM2ODE@._V1_UY209_CR5,0,140,209_AL_.jpg"
753,Tirez sur le pianiste,1960,81,"['Crime', ' Drama', ' Thriller']",François Truffaut,7.4,"A pianist helps his brother escape from two gangsters, who retaliate by abducting their kid brother.","https://m.media-amazon.com/images/M/MV5BYzgwMzA4OWYtNjIyNC00ZDkwLWIxMWItNzllNjA0NTU2ZTNlXkEyXkFqcGdeQXVyMjQzMzQzODY@._V1_UY209_CR8,0,140,209_AL_.jpg"
754,Timbuktu,2014,96,"['Drama', ' War']",Abderrahmane Sissako,7.1,A cattle herder and his family who reside in the dunes of Timbuktu find their quiet lives -- which are typically free of the Jihadists determined to control their faith -- abruptly disturbed.,"https://m.media-amazon.com/images/M/MV5BMjMwOTQ0NTUyMF5BMl5BanBnXkFtZTgwNDg3NDUxNDE@._V1_UY209_CR2,0,140,209_AL_.jpg"
755,Stage Door,1937,92,"['Comedy', ' Drama', ' Romance']",Gregory La Cava,7.7,"A chronicle of the ambitions, dreams, and disappointments of aspiring actresses who all live in the same boarding house.","https://m.media-amazon.com/images/M/MV5BNzQwNTQxOTY3OF5BMl5BanBnXkFtZTgwMTg0MDgyMTE@._V1_UX140_CR0,0,140,209_AL_.jpg"
756,Kanal,1957,91,"['Drama', ' War']",Andrzej Wajda,7.9,"In 1944, during the Warsaw uprising against the Nazis, Polish Lieutenant Zadra and his resistance fighters use Warsaw's sewer system to escape the German encirclement.","https://m.media-amazon.com/images/M/MV5BNzNlNGY1NjktNmVjYy00NWZkLWFjNjgtZDNhZmY1N2ZlOTQ5XkEyXkFqcGdeQXVyNzgzODI1OTE@._V1_UY209_CR2,0,140,209_AL_.jpg"
757,Sedotta e abbandonata,1964,118,"['Comedy', ' Drama']",Pietro Germi,7.9,"A desperate Sicilian man, whose 15-year-old daughter was seduced and impregnated by his older daughter's fiancé, tries to find a way to save the family's honor.","https://m.media-amazon.com/images/M/MV5BZjU0ZTZmMjctMWJiZC00ZTVhLTljZDMtYzE0ZGNhYTE1NjA5XkEyXkFqcGdeQXVyMTIyNzY1NzM@._V1_UY209_CR5,0,140,209_AL_.jpg"
